FeatureType,date,IMONum,deaths,missings,severeInjuries,description,latitude,longitude,subtype_field,subtype_value,gml_pos
HullAndEngineAccessoryDamage,20230401,,0,0,0,A bulk carrier had a poor condition pilot ladder.,53.5054,-3.1862,hullAndEngineAccessoryDamageType,outfit damage,-3.1862 53.5054
HullAndEngineAccessoryDamage,20230401,,0,0,0,Oil tanker's pilot ladder did not conform to SOLAS regulations.,51.863333,1.698333,hullAndEngineAccessoryDamageType,outfit damage,1.698333 51.863333
OtherIncident,20230401,,0,0,1,Hopper dredger's crew member has fallen which resulted in further medical assistance,51.941683,1.509817,otherIncidentType,other incident,1.509817 51.941683
CollisionAndContact,20230401,,0,0,0,Two sailing vessels collided which resulted in superficial damage.,50.7134,-1.4059,collisionAndContactType,collision,-1.4059 50.7134
OtherIncident,20230401,,0,0,1,"Sailing vessel's passenger fell onto another passenger, breaking their foot.",51.61805,-4.897783,otherIncidentType,other incident,-4.897783 51.61805
floodingAndSinking,20230401,,0,0,0,Fishing vessel was taking on water which resulted in successful pumping action.,51.490233,-5.08785,floodingAndSinkingType,flooding,-5.08785 51.490233
OtherIncident,20230401,,0,0,0,A potting vessel crewmember fell over board and was recovered.,55.629167,-6.7425,otherIncidentType,safety hinderance and near misses,-6.7425 55.629167
NavigationalIssues,20230401,,0,0,0,An inshore water ways passenger vessel became entangled in crab pot lines and subsequently grounded.,49.9513,-6.2621,navigationalIssuesType,sailing hinderance,-6.2621 49.9513
NavigationalIssues,20230401,,0,0,0,An anchor handling vessel experienced power failure.,49.9556,-5.5908,navigationalIssuesType,drifting,-5.5908 49.9556
StrandingAndGrounding,20230401,,0,0,0,A sail training vessel grounded during an assessment exercise.,50.79,-1.2933,strandingAndGroundingType,grounding,-1.2933 50.79
OtherIncident,20230401,,0,0,1,A cruise ship passenger slipped whilst descending the stairs and fractured their knee.,-35.02,151.271667,otherIncidentType,other incident,151.271667 -35.02
OtherIncident,20230401,,0,0,0,A search and rescue boat's daughter craft crew member fell over board when the boat heeled due to wind and waves.,56.338333,-2.775,otherIncidentType,safety hinderance and near misses,-2.775 56.338333
OtherIncident,20230401,,0,0,0,An inshore rescue boat crew member fell over board after slipping on a wet sponson.,50.277133,-3.88555,otherIncidentType,safety hinderance and near misses,-3.88555 50.277133
StrandingAndGrounding,20230401,,0,0,0,Inshore lifeboat was responding to an incident when they grounded,51.734,-4.629833,strandingAndGroundingType,grounding,-4.629833 51.734
NavigationalIssues,20230401,,0,0,0,Cargo vessel lost steering control however no damages reported.,51.3593,0.8466,navigationalIssuesType,loss of direction,0.8466 51.3593
OtherIncident,20230401,,0,0,1,Passenger ship's disabled guest fell out of their wheelchair and sustained a serious injury.,-18.026667,151.145,otherIncidentType,other incident,151.145 -18.026667
NavigationalIssues,20230401,,0,0,0,Charter yacht's engine failed resulting in a grounding and tow.,56.948902,-7.501833,navigationalIssuesType,drifting,-7.501833 56.948902
StrandingAndGrounding,20230401,,0,0,0,Commercial RIB was conducting crew transfer when it ran aground,51.6958,-5.0141,strandingAndGroundingType,grounding,-5.0141 51.6958
CollisionAndContact,20230401,,0,0,0,Fishing vessel made contact with a pleasure vessel.,51.4791,-3.7213,collisionAndContactType,collision,-3.7213 51.4791
FireAndExplosion,20230401,,0,0,0,Motor cruiser suffered an engine fire and were towed.,50.633833,-1.884333,fireAndExplosionType,fire,-1.884333 50.633833
OtherIncident,20230401,,0,0,1,Cruise ship passenger fell over in their bathroom resulting in a suspected fractured foot.,-17.95,119.316667,otherIncidentType,other incident,119.316667 -17.95
StrandingAndGrounding,20230501,,0,0,0,General cargo vessel grounded briefly in poor visibility.,53.701517,-0.823483,strandingAndGroundingType,grounding,-0.823483 53.701517
OtherIncident,20230401,,0,0,1,A replenishment tanker crewmember fell down whilst entering a hatch and fractured their ankle.,63.513333,-1.688333,otherIncidentType,safety hinderance and near misses,-1.688333 63.513333
StrandingAndGrounding,20230401,,0,0,0,A charter angling vessel grounded on a rock whilst taking evasive maneuvers to avoid an unmarked crab pot.,50.218,-3.6391,strandingAndGroundingType,grounding,-3.6391 50.218
floodingAndSinking,20230401,,0,0,0,RHIB became swamped and crew abandoned to another vessel.,56.4485,-6.5885,floodingAndSinkingType,sinking,-6.5885 56.4485
HullAndEngineAccessoryDamage,20230501,,0,0,0,General cargo vessel broke their anchor chain and lost one anchor.,57.267267,-5.831433,hullAndEngineAccessoryDamageType,hull damage,-5.831433 57.267267
NavigationalIssues,20230501,,0,0,0,Fishing vessel fouled its prop and were towed by sister vessel.,53.5235,0.574167,navigationalIssuesType,drifting,0.574167 53.5235
OtherIncident,20230501,,0,0,1,Class V passenger vessel guest slipped and suffered a suspected broken leg.,51.505,-0.0291,otherIncidentType,other incident,-0.0291 51.505
NavigationalIssues,20230401,,0,0,0,Fishing vessel sustained an engine failure and were towed by another fishing vessel.,49.761667,-4.952783,navigationalIssuesType,drifting,-4.952783 49.761667
OtherIncident,20230401,,0,0,1,Cruise ship passenger slipped and fell resulting in a back injury.,-25.268333,161.98,otherIncidentType,other incident,161.98 -25.268333
OtherIncident,20230401,,0,0,1,Cruise ship passenger fell in their bathroom resulting in a fractured hip and femur.,-16.282,122.5767,otherIncidentType,other incident,122.5767 -16.282
StrandingAndGrounding,20230401,,0,0,0,SAR craft grounded on tasking resulting in prop damage.,51.943333,-7.7625,strandingAndGroundingType,grounding,-7.7625 51.943333
CollisionAndContact,20230501,,0,0,0,Close quarters situation between Ro-Pax vessel and sailing vessel.,50.874,-1.3831,collisionAndContactType,collision,-1.3831 50.874
StrandingAndGrounding,20230401,,0,0,0,SAR craft grounded and sustained damage during a tasking.,55.118667,-6.025867,strandingAndGroundingType,grounding,-6.025867 55.118667
NavigationalIssues,20230501,,0,0,0,A small passenger vessel suffered engine failure and was assisted alongside.,50.1619,-5.0697,navigationalIssuesType,drifting,-5.0697 50.1619
CollisionAndContact,20230501,,0,0,1,Commercial rhib crewmember suffered a head injury following contact with unknown object.,50.7108,-1.9843,collisionAndContactType,contact,-1.9843 50.7108
StrandingAndGrounding,20230501,,0,0,0,A sailing yacht hit rocks with the lone sailor abandoning and the yacht later breaking up.,53.418333,-4.365,strandingAndGroundingType,grounding,-4.365 53.418333
OtherIncident,20230501,,0,0,1,Dive support vessel crewmember sustained a hand injury and was airlifted to shore.,60.596667,1.805,otherIncidentType,other incident,1.805 60.596667
OtherIncident,20230501,,0,0,1,A research vessel passenger fell and sustained minor head and back injuries.,57.476667,-6.788333,otherIncidentType,other incident,-6.788333 57.476667
HullAndEngineAccessoryDamage,20230401,,0,0,0,Container ship pilot ladder not rigged per SOLAS regulations.,51.4948,0.5436,hullAndEngineAccessoryDamageType,outfit damage,0.5436 51.4948
OtherIncident,20230401,,0,0,1,A tug crew member suffered a broken knee after getting their leg caught in the bight of a rope.,51.4963,0.0316,otherIncidentType,other incident,0.0316 51.4963
OtherIncident,20230501,,0,0,1,Sailing passenger vessel crewmember fell down stairs and sustained a head injury.,51.732333,0.722017,otherIncidentType,other incident,0.722017 51.732333
OtherIncident,20230501,,0,0,1,Fishing vessel crewmember caught by fishing nets and potentially fractured pelvis,49.834003,-5.1053,otherIncidentType,other incident,-5.1053 49.834003
HullAndEngineAccessoryDamage,20230501,,0,0,0,Tug towline parted when towing a ro-ro cargo vessel,53.680667,0.235533,hullAndEngineAccessoryDamageType,machineries and propulsion damage,0.235533 53.680667
NavigationalIssues,20230501,,0,0,0,Ro-ro cargo vessel suffered a malfunction of main engine exhaust valve unit no.1,51.459333,0.287167,navigationalIssuesType,drifting,0.287167 51.459333
OtherIncident,20230501,,0,0,1,A cruise ship passenger fell and banged their head in their cabin and was medically disembarked.,37.653333,-122.666667,otherIncidentType,other incident,-122.666667 37.653333
OtherIncident,20230501,,0,0,1,Cruise ship's passenger fell and sustained a serious injury.,-29.798333,155.99,otherIncidentType,other incident,155.99 -29.798333
OtherIncident,20221201,,0,0,0,Container ship crew member fell overboard whilst passing a rope around the outboard side of a pillar,37.9213,23.6078,otherIncidentType,safety hinderance and near misses,23.6078 37.9213
NavigationalIssues,20230501,,0,0,0,A ro-pax vessel's generator suffered a high temperature alarm and shut down resulting in loss of main engines.,54.956667,-5.388333,navigationalIssuesType,sailing hinderance,-5.388333 54.956667
OtherIncident,20230401,,0,0,1,A cruise ship crew member missed a step which resulted in a twisted knee.,33.566667,136.878333,otherIncidentType,safety hinderance and near misses,136.878333 33.566667
NavigationalIssues,20230501,,0,0,0,A fishing trawler suffered overheating issues and broke down and had to be towed to shore.,27.2568,-15.6616,navigationalIssuesType,drifting,-15.6616 27.2568
NavigationalIssues,20230501,,0,0,0,Angling charter vessel lost propulsion and was towed back to port,50.515,-5.195,navigationalIssuesType,drifting,-5.195 50.515
StrandingAndGrounding,20230501,,0,0,0,A sailing vessel ran aground on a submerged wreck and refloated without damage.,51.403,1.204233,strandingAndGroundingType,grounding,1.204233 51.403
HullAndEngineAccessoryDamage,20230501,,0,0,0,USV released survey equipment onto the seabed as a procedure.,53.688333,-4.019,hullAndEngineAccessoryDamageType,machineries and propulsion damage,-4.019 53.688333
NavigationalIssues,20230501,,0,0,0,Fishing vessel lost propulsion and was towed back to port,56.293333,-8.336667,navigationalIssuesType,drifting,-8.336667 56.293333
CollisionAndContact,20230501,,0,0,0,A crew transfer vessel made contact with a turbine which resulted in minor damage to vessel.,54.989667,13.154167,collisionAndContactType,contact,13.154167 54.989667
NavigationalIssues,20230401,,0,0,0,A charter RIB was allegedly pushed into a pier by the water displaced from a Ro-PAX ferry bow thruster,59.0265,-2.904833,navigationalIssuesType,sailing hinderance,-2.904833 59.0265
CollisionAndContact,20230501,,0,0,0,Fishing vessel and charter angling vessel collided,50.4073,-3.515,collisionAndContactType,collision,-3.515 50.4073
OtherIncident,20230401,,0,0,1,A canal boat passenger fell over and sustained an arm injury,51.5367,0.0714,otherIncidentType,other incident,0.0714 51.5367
floodingAndSinking,20230301,,0,0,0,Small commercial craft began taking on water and partially sank,50.6164,-3.4227,floodingAndSinkingType,flooding,-3.4227 50.6164
FireAndExplosion,20230501,,0,0,0,A sailing yacht suffered an electrical fire that was quickly extinguished,50.72,-2.931667,fireAndExplosionType,fire,-2.931667 50.72
OtherIncident,20230501,,0,0,1,Cruise ship's passenger tripped and fell resulting in a fractured wrist.,52.223333,2.708333,otherIncidentType,other incident,2.708333 52.223333
FireAndExplosion,20230501,,0,0,1,Recreational sailing vessel suffered an explosion which resulted with a sinking vessel and a serious injury.,54.391567,-7.678883,fireAndExplosionType,fire,-7.678883 54.391567
FireAndExplosion,20230501,,0,0,1,Sailing vessel suffered a fire which resulted in a serious injury and loss of vessel.,56.950717,-2.1841,fireAndExplosionType,fire,-2.1841 56.950717
HullAndEngineAccessoryDamage,20230501,,0,0,0,Container ship's pilot ladder did not conform to SOLAS regulations.,51.4,1.521667,hullAndEngineAccessoryDamageType,outfit damage,1.521667 51.4
OtherIncident,20230501,,0,0,1,Cruise ship's passenger slipped which resulted in a closed fracture,53.745,-131.026667,otherIncidentType,other incident,-131.026667 53.745
NavigationalIssues,20230501,,0,0,0,Diving vessel suffered machinery failure and resulted in no Injuries,53.5899,0.776883,navigationalIssuesType,drifting,0.776883 53.5899
OtherIncident,20230501,,0,0,1,Sailing vessel's crew member sustained an injury to the face after getting hit with a stationary propeller.,49.921383,-6.315833,otherIncidentType,other incident,-6.315833 49.921383
NavigationalIssues,20230501,,0,0,0,Oil tanker's main engine failed which resulted in a full blackout.,51.4315,0.7168,navigationalIssuesType,sailing hinderance,0.7168 51.4315
OtherIncident,20230101,,0,0,1,Inland waterway vessel's crew member tripped on a step and injured their ankle.,50.6362,-4.3058,otherIncidentType,safety hinderance and near misses,-4.3058 50.6362
OtherIncident,20230501,,0,0,1,Cruise ship's passenger slipped and dislocated their knee.,-24.723333,159.692333,otherIncidentType,other incident,159.692333 -24.723333
HullAndEngineAccessoryDamage,20230501,,0,0,0,LNG tanker crew used a weighted heaving line.,51.7025,-5.0353,hullAndEngineAccessoryDamageType,outfit damage,-5.0353 51.7025
CollisionAndContact,20230401,,0,0,0,Near miss between paddleboarders and an inland waterway vessels.,51.5235,-0.1791,collisionAndContactType,contact,-0.1791 51.5235
OtherIncident,20230501,,0,0,1,Cruise ship's crew member caught their toe under the door,-18.996667,167.716667,otherIncidentType,other incident,167.716667 -18.996667
StrandingAndGrounding,20230501,,0,0,0,general cargo grounded due to a strong current resulting in no damage.,53.341667,-2.958333,strandingAndGroundingType,grounding,-2.958333 53.341667
OtherIncident,20230501,,0,0,1,Sailing vessel's crew member sustained an injury while hoisting the mizzen sail.,50.755233,-1.4314,otherIncidentType,other incident,-1.4314 50.755233
OtherIncident,20230401,,0,0,1,Sail training vessel passenger suffered broken ribs after falling onto main hatch rails.,50.8122,-1.2694,otherIncidentType,other incident,-1.2694 50.8122
floodingAndSinking,20230501,,0,0,0,Pleasure vessel was taking on water which resulted in total loss of vessel and a missing person.,50.453633,-3.294317,floodingAndSinkingType,sinking,-3.294317 50.453633
CollisionAndContact,20230501,,0,0,0,A tug was towing two barges when it made contact with a bridge.,50.4089,-4.2055,collisionAndContactType,collision,-4.2055 50.4089
OtherIncident,20230501,,0,0,1,A fishing potter crew member was dragged over board with the pots.,56.923333,-1.947167,otherIncidentType,other incident,-1.947167 56.923333
StrandingAndGrounding,20230501,,0,0,0,A recreational sailing vessel ran aground and was subsequently flooded and sank on the rising tide.,53.694,-0.5458,strandingAndGroundingType,grounding,-0.5458 53.694
StrandingAndGrounding,20230401,,0,0,0,A bulk carrier ran aground and sustained water ingress into the ballast tanks.,-1.9,130.65,strandingAndGroundingType,grounding,130.65 -1.9
floodingAndSinking,20230501,,0,0,0,Pleasure vessel sank with three people on board.,50.618333,-1.913333,floodingAndSinkingType,sinking,-1.913333 50.618333
StrandingAndGrounding,20230501,,0,0,0,An excursion passenger boat ran aground and the passengers and crew were rescued.,78.2331,14.0964,strandingAndGroundingType,grounding,14.0964 78.2331
floodingAndSinking,20230501,,1,0,1,A personal watercraft capsized resulting in one fatality and one serious injury,54.043,-6.136,floodingAndSinkingType,capsizing,-6.136 54.043
FireAndExplosion,20230501,,0,0,0,"A pleasure yacht caught fire and was abandoned, the wreck later sinking.",56.9055,-5.901167,fireAndExplosionType,fire,-5.901167 56.9055
NavigationalIssues,20230501,,0,0,0,A fishing vessel experienced propulsion failure and was towed back alongside.,59.0745,-2.899167,navigationalIssuesType,drifting,-2.899167 59.0745
floodingAndSinking,20230501,,0,0,0,"A cabin cruiser was taking on water and sank, the two crew were rescued by lifeboat.",51.23,-4.05,floodingAndSinkingType,sinking,-4.05 51.23
OtherIncident,20230501,,0,0,1,A fishing trawler crew member sustained a crush injury to their hand.,57.5317,-13.539,otherIncidentType,other incident,-13.539 57.5317
NavigationalIssues,20230501,,0,0,0,A high speed passenger vessel suffered propulsion failure due to a problem with the propeller shaft.,50.74,-1.164,navigationalIssuesType,sailing hinderance,-1.164 50.74
floodingAndSinking,20230501,,0,0,0,"A single handed fishing trawler damaged its trawl doors, breaching the hull and was towed to port.",54.6912,-4.002733,floodingAndSinkingType,sinking,-4.002733 54.6912
OtherIncident,20230501,,0,0,1,A cruise ship passenger sustained a broken ankle when descending the stairs.,-15.465,124.526667,otherIncidentType,other incident,124.526667 -15.465
HullAndEngineAccessoryDamage,20230501,,0,0,0,A crude oil tanker had a non-SOLAS Compliant pilot ladder.,55.456767,-4.799133,hullAndEngineAccessoryDamageType,outfit damage,-4.799133 55.456767
OtherIncident,20230501,,0,0,1,A cruise ship passenger tripped whilst exiting their bathroom and sustained a fractured ankle.,-21.321667,170.308333,otherIncidentType,other incident,170.308333 -21.321667
StrandingAndGrounding,20230501,,0,0,0,A sail training vessel ran aground.,50.812,-1.2982,strandingAndGroundingType,grounding,-1.2982 50.812
HullAndEngineAccessoryDamage,20230501,,0,0,0,Bulk carrier's pilot ladder not rigged per SOLAS regulations.,51.4465,0.3831,hullAndEngineAccessoryDamageType,outfit damage,0.3831 51.4465
NavigationalIssues,20230501,,0,0,0,A fishing vessel fouled its propeller and was towed back to port.,55.91,-2.131667,navigationalIssuesType,sailing hinderance,-2.131667 55.91
OtherIncident,20230501,,0,0,1,A cruise ship passenger fell down a staircase and injured their elbow requiring medical evacuation.,58.786667,-2.865,otherIncidentType,other incident,-2.865 58.786667
OtherIncident,20230501,,1,0,0,Sailing vessel crewmember fell overboard and confirmed deceased during a race.,50.182717,0.161593,otherIncidentType,other incident,0.161593 50.182717
OtherIncident,20230501,,1,0,0,Sailing yacht crewmember presumed deceased after falling overboard during a race.,49.662,-0.1583,otherIncidentType,other incident,-0.1583 49.662
OtherIncident,20230501,,1,0,0,PW user was declared deceased after falling off the craft.,50.8042,-0.4102,otherIncidentType,other incident,-0.4102 50.8042
OtherIncident,20230501,,0,0,1,Fishing vessel crewmember fell overboard and was wrapped in the anchor chain.,52.938667,0.265333,otherIncidentType,other incident,0.265333 52.938667
CollisionAndContact,20230501,,0,0,1,Three PWs were racing with 2 colliding with a powerboat resulting in a injury.,52.53945,-4.0533,collisionAndContactType,collision,-4.0533 52.53945
OtherIncident,20230501,,0,0,1,Training RIB crewmember fell overboard and was struck by the propeller resulting in a minor injury.,52.2543,-0.2521,otherIncidentType,other incident,-0.2521 52.2543
NavigationalIssues,20230501,,0,0,0,Leisure fishing vessel's engines failed resulting in grounding and sinking. Vessel recovered the next day.,50.822,-1.315933,navigationalIssuesType,sailing hinderance,-1.315933 50.822
FireAndExplosion,20230501,,0,0,0,Cruise ship suffered a fire on a guest balcony which was quickly extinguished.,-35.678333,151.015,fireAndExplosionType,fire,151.015 -35.678333
OtherIncident,20230501,,0,0,2,Small high speed cruise vessel was hit by a large wave resulting in two passenger injuries.,57.8025,-7.1908,otherIncidentType,other incident,-7.1908 57.8025
OtherIncident,20230501,,0,0,1,Utility vessel crewmember suffered a hand injury while closing the bridge watertight door.,41.221333,-70.430167,otherIncidentType,safety hinderance and near misses,-70.430167 41.221333
StrandingAndGrounding,20230501,,0,0,0,Sail training vessel grounded whilst tacking resulting in no damage or injuries.,50.6643,-1.5959,strandingAndGroundingType,grounding,-1.5959 50.6643
HullAndEngineAccessoryDamage,20230501,,0,0,0,Survey vessel pulled up a suspected mine which was confirmed as being casing only and inert.,51.6872,-5.1347,hullAndEngineAccessoryDamageType,hull damage,-5.1347 51.6872
floodingAndSinking,20230601,,0,0,0,Hopper dredger suffered water ingress from a leak in its hull,53.55,0.066667,floodingAndSinkingType,flooding,0.066667 53.55
HullAndEngineAccessoryDamage,20230501,,0,0,0,A search and rescue vessel's fire alarm sounded due to smoke in the engine room.,55.168833,-5.028333,hullAndEngineAccessoryDamageType,machineries and propulsion damage,-5.028333 55.168833
floodingAndSinking,20230501,,0,0,0,Sailing yacht capsized with the person and vessel recovered to shore by lifeboat.,50.8678,-1.353033,floodingAndSinkingType,capsizing,-1.353033 50.8678
NavigationalIssues,20230601,,0,0,0,Single handed fishing vessel was towed by lifeboat which had rope wrapped around propeller.,50.209333,-5.4415,navigationalIssuesType,drifting,-5.4415 50.209333
StrandingAndGrounding,20230501,,0,0,0,Lifeboat was returning from tasking when it grounded.,55.069667,-1.45,strandingAndGroundingType,grounding,-1.45 55.069667
floodingAndSinking,20230501,,0,0,0,A search and rescue vessel was training when 2 people fell overboard and the vessel capsized.,50.5746,-4.9176,floodingAndSinkingType,capsizing,-4.9176 50.5746
StrandingAndGrounding,20230501,,0,0,0,Lifeboat was on tasking when it struck a rock.,53.2227,-4.1707,strandingAndGroundingType,grounding,-4.1707 53.2227
CollisionAndContact,20230501,,0,0,0,Taxi vessel service near miss with SUP.,50.352417,-3.570867,collisionAndContactType,collision,-3.570867 50.352417
StrandingAndGrounding,20230501,,0,0,0,A search and rescue vessel grounded on a rock resulting in minor damage,53.2788,-4.62,strandingAndGroundingType,grounding,-4.62 53.2788
CollisionAndContact,20230501,,0,0,0,Yacht taxi had a near miss situation with a small ferry.,50.349233,-3.575267,collisionAndContactType,collision,-3.575267 50.349233
OtherIncident,20230401,,0,0,0,A search and rescue vessel was assisting casualties in the water when the crew fell overboard.,49.1812,-2.1242,otherIncidentType,safety hinderance and near misses,-2.1242 49.1812
HullAndEngineAccessoryDamage,20230501,,0,0,0,A container vessel had a non-SOLAS conforming pilot ladder.,51.5039,0.6248,hullAndEngineAccessoryDamageType,outfit damage,0.6248 51.5039
HullAndEngineAccessoryDamage,20230501,,0,0,0,An offshore supply vessel had a non-SOLAS compliant pilot ladder arrangement.,51.5038,0.6279,hullAndEngineAccessoryDamageType,outfit damage,0.6279 51.5038
HullAndEngineAccessoryDamage,20230501,,0,0,0,A general cargo vessel had a non-SOLAS compliant pilot ladder arrangement.,52.5726,1.739,hullAndEngineAccessoryDamageType,outfit damage,1.739 52.5726
OtherIncident,20230601,,0,0,1,Passenger on a ferry tripped when stepping to the pontoon and injured their leg.,50.3506,-3.5757,otherIncidentType,safety hinderance and near misses,-3.5757 50.3506
CollisionAndContact,20230501,,0,0,0,Ferry hit a submerged object and lost propulsion.,50.336167,-4.4585,collisionAndContactType,collision,-4.4585 50.336167
OtherIncident,20230501,,0,0,1,Cruise ship's passenger sustained an injury after falling.,48.511667,-5.886667,otherIncidentType,other incident,-5.886667 48.511667
NavigationalIssues,20230501,,0,0,0,Fishing vessel's engine failed and towage was requested.,51.00495,1.3762,navigationalIssuesType,drifting,1.3762 51.00495
FireAndExplosion,20230501,,0,0,0,Pleasure vessel suffered an engine fire which resulted in no injuries.,50.70255,-1.54675,fireAndExplosionType,fire,-1.54675 50.70255
NavigationalIssues,20230601,,0,0,0,A fishing vessel suffered an engine failure and requested assistance,56.1128,-5.785483,navigationalIssuesType,drifting,-5.785483 56.1128
OtherIncident,20230501,,0,0,1,An offshore support vessel crewmember fell in their bathroom and sustained a head injury.,58.159567,-6.19415,otherIncidentType,other incident,-6.19415 58.159567
OtherIncident,20230501,,0,0,1,Dive vessel's crew member sustained a finger injury which resulted in amputation.,50.663667,-1.598217,otherIncidentType,other incident,-1.598217 50.663667
CollisionAndContact,20230501,,0,0,0,A small ro-pax vessel made light contact with a submerged object during passage,60.4255,-0.751667,collisionAndContactType,contact,-0.751667 60.4255
StrandingAndGrounding,20230601,,0,0,0,A sail training yacht grounded and later re-floated with the flood tide,50.7399,-1.13565,strandingAndGroundingType,stranding,-1.13565 50.7399
OtherIncident,20230601,,0,0,1,A service vessel crew member was injured whilst trying to free an anchor,50.346667,-4.148333,otherIncidentType,safety hinderance and near misses,-4.148333 50.346667
OtherIncident,20230501,,0,0,1,Cruise ships passenger slipped and sustained a fractured wrist,-31.15,153.316667,otherIncidentType,other incident,153.316667 -31.15
OtherIncident,20230601,,0,0,1,Cruise ship's passenger sustained an injury by twisting their ankle.,-20.783333,149.73,otherIncidentType,other incident,149.73 -20.783333
OtherIncident,20230601,,0,0,1,Cruise ships passenger tripped and sustained a fractured femur.,58.731667,-136.263333,otherIncidentType,other incident,-136.263333 58.731667
OtherIncident,20230601,,0,0,1,Cruise ship passenger tripped on a mat and sustained a fracture injury.,32.073333,133.611667,otherIncidentType,safety hinderance and near misses,133.611667 32.073333
OtherIncident,20230501,,0,0,1,Cruise ships passenger fell and sustained a closed fracture,56.593333,-6.423333,otherIncidentType,other incident,-6.423333 56.593333
HullAndEngineAccessoryDamage,20230601,,0,0,0,A bulk carrier had a Non-Compliant pilot ladder arrangement.,53.5041,-3.1859,hullAndEngineAccessoryDamageType,outfit damage,-3.1859 53.5041
