FeatureType,date,IMONum,deaths,missings,severeInjuries,description,latitude,longitude,subtype_field,subtype_value,gml_pos
StrandingAndGrounding,20220901,,0,0,0,A motor vessel with 3POB ran aground on rocks and the people were rescued,57.3576,-6.6685,strandingAndGroundingType,grounding,-6.6685 57.3576
OtherIncident,20220901,,0,0,1,A cruise ship crew member was injured whilst securing tenders,53.304,-6.0863,otherIncidentType,safety hinderance and near misses,-6.0863 53.304
OtherIncident,20220901,,0,0,1,General cargo vessel crewmember injured their finger while moving a portable gangway.,-33.6856,-48.0813,otherIncidentType,other incident,-81.7669
OtherIncident,20220901,,0,0,1,Fishing vessel crewmember was airlifted to hospital resulting from a fall in the hold.,51.704083,-5.117317,otherIncidentType,other incident,-5.117317 51.704083
OtherIncident,20220801,,0,0,1,Ro/Ro passenger vessel crewmember sustained ligament damage to their finger while removing a door from its hinges.,55.6408,-4.8467,otherIncidentType,other incident,-4.8467 55.6408
OtherIncident,20220901,,0,0,1,Cruise ship passenger fractured their shoulder following a fall while leaving the theatre.,57.18,-7.01,otherIncidentType,other incident,-7.01 57.18
CollisionAndContact,20220801,,0,0,0,Close quarters situation between a cement carrier and a yacht.,51.3942,0.6227,collisionAndContactType,collision,0.6227 51.3942
OtherIncident,20220701,,0,0,1,Workboat crewman sustained a back injury during netwash operations.,56.0826,-6.1572,otherIncidentType,other incident,-6.1572 56.0826
StrandingAndGrounding,20220901,,0,0,1,RIB passenger unresponsive after grounding.,49.9475,-6.3007,strandingAndGroundingType,stranding,-6.3007 49.9475
FireAndExplosion,20220901,,0,0,0,Container ship suffered an engine failure and small fire resulting in a tow to deep water anchorage.,51.64055,1.36055,fireAndExplosionType,fire,1.36055 51.64055
CollisionAndContact,20220801,,0,0,0,A search and rescue vessel sustained minor damage after making contact with a pontoon.,53.32,-6.1713,collisionAndContactType,contact,-6.1713 53.32
OtherIncident,20220901,,0,0,1,Cruise ship passenger fell down stairs resulting in a broken wrist.,43.513333,-9.086667,otherIncidentType,other incident,-9.086667 43.513333
StrandingAndGrounding,20220901,,0,0,0,Small commercial inland waterway passenger vessel ran aground.,51.2669,0.5149,strandingAndGroundingType,grounding,0.5149 51.2669
floodingAndSinking,20220901,,0,0,0,Fishing vessel sunk in 5 metres of water with the 2 crew rescued successfully with no injuries.,56.523667,-5.507833,floodingAndSinkingType,sinking,-5.507833 56.523667
StrandingAndGrounding,20220901,,0,0,0,Hire cruiser grounded and was recovered with no reported damage or injuries.,52.6077,1.7029,strandingAndGroundingType,grounding,1.7029 52.6077
HullAndEngineAccessoryDamage,20220901,,0,0,0,Small passenger ferry was towed by another vessel following water cock issue.,50.3429,-4.1713,hullAndEngineAccessoryDamageType,machineries and propulsion damage,-4.1713 50.3429
FireAndExplosion,20220901,,0,0,0,Cruise ship suffered a small electrical fire in the pantry galley.,-27.565,153.97,fireAndExplosionType,fire,153.97 -27.565
HullAndEngineAccessoryDamage,20220901,,0,0,0,Survey vessel's pin holding the trawl block slipped resulting in retaining plate falling.,52.63,-4.29,hullAndEngineAccessoryDamageType,machineries and propulsion damage,-4.29 52.63
OtherIncident,20220901,,0,0,1,Fishing vessel crewmember amputated finger in block whilst heaving gear.,57.871667,-0.013333,otherIncidentType,other incident,-0.013333 57.871667
floodingAndSinking,20220901,,0,0,0,RIB capsized and required a tow from a lifeboat,51.607883,-4.889867,floodingAndSinkingType,capsizing,-4.889867 51.607883
floodingAndSinking,20220901,,0,0,0,Powerboat experienced water ingress and was towed by a rescue boat,56.001467,-3.37195,floodingAndSinkingType,flooding,-3.37195 56.001467
OtherIncident,20220901,,0,0,1,Cruise ship passenger dislocated their hip.,41.744,4.2679,otherIncidentType,other incident,4.2679 41.744
NavigationalIssues,20220901,,0,0,0,A fishing vessel fouled it's propellor and also collided with a tug,56.135833,-2.190833,navigationalIssuesType,sailing hinderance,-2.190833 56.135833
HullAndEngineAccessoryDamage,20220901,,0,0,0,Chemical/Products tanker had a non-SOLAS-conforming pilot ladder arrangement,51.4956,0.6062,hullAndEngineAccessoryDamageType,hull damage,0.6062 51.4956
HullAndEngineAccessoryDamage,20220901,,0,0,0,A bulk/oil/chemical carrier vessel had a non-SOLAS-conforming pilot ladder,51.6963,-5.1266,hullAndEngineAccessoryDamageType,outfit damage,-5.1266 51.6963
CollisionAndContact,20220801,,0,0,1,A motor cruiser and pwc collided resulting in one injury and damage to both vessels.,56.0763,-4.6324,collisionAndContactType,collision,-4.6324 56.0763
OtherIncident,20220901,,0,0,1,A cruise ship crewmember fell while using a staircase,-18.8883,151.715,otherIncidentType,other incident,151.715 -18.8883
OtherIncident,20220901,,0,0,1,A cruise ship passenger slipped on a wet floor resulting in broken ribs,48.6,-125.4433,otherIncidentType,other incident,-125.4433 48.6
StrandingAndGrounding,20220901,,0,0,0,A sailing vessel grounded,50.8078,-1.2917,strandingAndGroundingType,grounding,-1.2917 50.8078
OtherIncident,20220901,,0,0,1,A cruise ship passenger sustained a serious injury from a fall,58.9133,-137.0317,otherIncidentType,other incident,-137.0317 58.9133
FireAndExplosion,20220901,,0,0,0,Recreational craft experienced an outboard engine fire,54.3008,-7.638,fireAndExplosionType,fire,-7.638 54.3008
NavigationalIssues,20220901,,0,0,0,A yacht experienced machinery failure and was at risk of going aground,57.7167,-3.0833,navigationalIssuesType,sailing hinderance,-3.0833 57.7167
FireAndExplosion,20220901,,0,0,0,A sailing vessel experienced a fire and subsequent propulsion failure,54.0756,-0.1646,fireAndExplosionType,fire,-0.1646 54.0756
NavigationalIssues,20220901,,0,0,0,A single-handed pleasure fishing vessel experienced engine failure,50.2245,-5.4785,navigationalIssuesType,drifting,-5.4785 50.2245
StrandingAndGrounding,20220901,,0,0,0,A sailing vessel with 1POB ran aground,52.8176,-4.5716,strandingAndGroundingType,grounding,-4.5716 52.8176
FireAndExplosion,20220901,,0,0,0,Ro-pax ferry trailer on car deck caught fire,49.905,-5.076667,fireAndExplosionType,fire,-5.076667 49.905
OtherIncident,20220901,,0,0,1,A cruise ship passenger fell resulting in a serious injury,-24.8017,153.6067,otherIncidentType,other incident,153.6067 -24.8017
OtherIncident,20220901,,0,0,1,A cruise ship passenger suffered amputation of finger tip,58.1333,-135.4683,otherIncidentType,other incident,-135.4683 58.1333
floodingAndSinking,20220901,,0,0,0,Crew supply vessel suffered flooding and was towed by a vessel,52.5865,1.757333,floodingAndSinkingType,flooding,1.757333 52.5865
floodingAndSinking,20220901,,0,0,0,"An inshore lifeboat capsized whilst attempting a rescue of a swimmer, who later died.",56.0283,-2.5967,floodingAndSinkingType,capsizing,-2.5967 56.0283
OtherIncident,20220901,,0,0,1,A cruise ship passenger slipped on a wet floor and fractured their knee,49.77,-128.0183,otherIncidentType,safety hinderance and near misses,-128.0183 49.77
HullAndEngineAccessoryDamage,20220901,,0,0,0,A general cargo ship had a non-SOLAS conforming pilot ladder arrangement,53.5045,-3.1876,hullAndEngineAccessoryDamageType,outfit damage,-3.1876 53.5045
floodingAndSinking,20220901,,0,0,0,A fishing vessel developed an uncontrollable ingress of water and sank,44.75,-9.5,floodingAndSinkingType,sinking,-9.5 44.75
CollisionAndContact,20220901,,0,0,0,A close quarters situation occurred between two fishinf vessels,57.777,-3.2567,collisionAndContactType,contact,-3.2567 57.777
OtherIncident,20220901,,0,0,1,A search and rescue vessel crew member dislocated their knee while pushing the vessel away from the pontoon with their foot,52.41,-4.09,otherIncidentType,other incident,-4.09 52.41
NavigationalIssues,20220901,,0,0,0,Recreational motor vessel suffered power failure and was unable to recover anchor so was towed back to port,50.6741,-0.006,navigationalIssuesType,drifting,-0.006 50.6741
OtherIncident,20220901,,0,0,1,A hopper dredger crew member fractured their leg,51.484667,0.204333,otherIncidentType,safety hinderance and near misses,0.204333 51.484667
StrandingAndGrounding,20220901,,0,0,2,A private motor cruiser ran aground on a beach,50.6755,-1.5636,strandingAndGroundingType,grounding,-1.5636 50.6755
NavigationalIssues,20220901,,0,0,0,A single-handed fishing vessel suffered propulsion failure and was towed back to port,57.3896,-1.8541,navigationalIssuesType,drifting,-1.8541 57.3896
OtherIncident,20220901,,0,0,1,A cruise ship passenger fractured their toe after slipping on a step while entering a swimming pool,31.4383,-125.0233,otherIncidentType,other incident,-125.0233 31.4383
OtherIncident,20220901,,1,0,0,Not available Under Permanent Cooperation Framework (PCF),54.7483,-1.155,otherIncidentType,other incident,-1.155 54.7483
FireAndExplosion,20220901,,0,0,0,A yacht suffered engine fire that was extinguished by the crew,52.0233,1.3574,fireAndExplosionType,fire,1.3574 52.0233
OtherIncident,20220901,,0,0,0,A crew member fell overboard from a yacht and was recovered by a police vessel,50.404083,-4.201917,otherIncidentType,other incident,-4.201917 50.404083
OtherIncident,20220901,,0,0,3,Two crew members fell overboard from a RIB and were recovered by the third crew member,50.45555,-3.524133,otherIncidentType,other incident,-3.524133 50.45555
OtherIncident,20220901,,0,0,1,A fishing vessel crew member sustained minor injuries after a wave came over the deck,52.9717,2.402,otherIncidentType,safety hinderance and near misses,2.402 52.9717
OtherIncident,20220901,,0,0,1,A cruise ship passenger fell and sustained a pelvic fracture,26.2183,-143.23,otherIncidentType,other incident,-143.23 26.2183
NavigationalIssues,20220901,,0,0,0,General cargo vessel suffered mechanical failure due to suspected water-contaminated fuel oil,39.583333,18.533333,navigationalIssuesType,drifting,18.533333 39.583333
OtherIncident,20220901,,0,0,1,A platform supply vessel crew member fell overboard,55,-1.4,otherIncidentType,other incident,-1.4 55.0
OtherIncident,20220901,,0,0,1,A hire boat customer slipped and fell whilst disembarking from the vessel,52.6196,1.4365,otherIncidentType,other incident,1.4365 52.6196
HullAndEngineAccessoryDamage,20220901,,0,0,0,A products tanker's pilot ladder did not conform to SOLAS regulations,50.1339,-5.0334,hullAndEngineAccessoryDamageType,outfit damage,-5.0334 50.1339
StrandingAndGrounding,20220901,,0,0,0,A sailing yacht ran aground and refloated with minor damage,51.394,-3.2031,strandingAndGroundingType,grounding,-3.2031 51.394
NavigationalIssues,20220901,,0,0,0,A lone skipper on a  sailing yacht suffered propulsion failure and was towed,49.8492,-5.1888,navigationalIssuesType,sailing hinderance,-5.1888 49.8492
OtherIncident,20220901,,0,0,1,Ro-pax ferry passenger fell in the shower and was disembarked to hospital,50.3265,-4.1558,otherIncidentType,other incident,-4.1558 50.3265
OtherIncident,20220901,,0,0,1,A cruise ship crewmember got chemicals in their eye,55.066667,10.966667,otherIncidentType,other incident,10.966667 55.066667
floodingAndSinking,20220901,,0,0,0,A general cargo vessel suffered water ingress due to a faulty ballast valve,53.549,0.2275,floodingAndSinkingType,flooding,0.2275 53.549
NavigationalIssues,20220901,,0,0,0,A port tender suffered propulsion failure and couldn't anchor,51.4283,-3.63,navigationalIssuesType,drifting,-3.63 51.4283
NavigationalIssues,20220901,,0,0,0,A fishing vessel fouled its propeller and was towed,55.9075,-7.3845,navigationalIssuesType,sailing hinderance,-7.3845 55.9075
OtherIncident,20221001,,1,0,0,"See MAIB investigation report, when available",50.772067,-1.31,otherIncidentType,other incident,-1.31 50.772067
OtherIncident,20220901,,0,0,1,A cruise ship passenger sustained a broken hip after a fall,23.8867,-151.0883,otherIncidentType,other incident,-151.0883 23.8867
StrandingAndGrounding,20221001,,0,0,0,A chartered sailing vessel ran aground and was recovered with lifeboat assistance,50.7803,-1.0206,strandingAndGroundingType,grounding,-1.0206 50.7803
OtherIncident,20221001,,0,0,1,A inshore passenger vessel passenger fell between the vessel and the quay,51.4565,-0.3053,otherIncidentType,other incident,-0.3053 51.4565
HullAndEngineAccessoryDamage,20221001,,0,0,0,A general cargo vessel had a non-SOLAS compliant pilot ladder,50.3083,-4.175,hullAndEngineAccessoryDamageType,outfit damage,-4.175 50.3083
OtherIncident,20221001,,0,0,1,A fishing vessel crewmember sustained a hand injury,58.0345,0.7645,otherIncidentType,other incident,0.7645 58.0345
NavigationalIssues,20221001,,0,0,0,A fisheries patrol vessel experienced propulsion failure,58.0933,-2.3617,navigationalIssuesType,drifting,-2.3617 58.0933
OtherIncident,20221001,,0,0,1,A pelagic trawler crewmember sustained a laceration to the hand,58.8667,-0.8167,otherIncidentType,other incident,-0.8167 58.8667
NavigationalIssues,20220901,,0,0,0,A search and rescue craft suffered propulsion failure during a rescue operation,50.936,1.2595,navigationalIssuesType,sailing hinderance,1.2595 50.936
StrandingAndGrounding,20220901,,0,0,0,A search and rescue vessel grounded on a submerged rock during an exercise,55.039,-1.4243,strandingAndGroundingType,grounding,-1.4243 55.039
CollisionAndContact,20221001,,0,0,0,A survey vessel allided with a shore structure after drifting off track due to tide,51.2103,-3.1359,collisionAndContactType,collision,-3.1359 51.2103
NavigationalIssues,20221001,,0,0,0,A beam trawler suffered gearbox failure and was towed back to port,50.4167,-1.4433,navigationalIssuesType,drifting,-1.4433 50.4167
floodingAndSinking,20221001,,0,0,0,A fishing vessel was taking on water,50.760833,-1.343167,floodingAndSinkingType,flooding,-1.343167 50.760833
NavigationalIssues,20221001,,0,0,0,A single handed creel vessel experienced propulsion failure and associated water ingress and was towed to safety,57.7667,-1.9915,navigationalIssuesType,drifting,-1.9915 57.7667
floodingAndSinking,20221001,,0,0,0,An ocean rowing vessel capsized and the occupant rescued,53.2283,-9.3,floodingAndSinkingType,capsizing,-9.3 53.2283
HullAndEngineAccessoryDamage,20221001,,0,0,0,A recreational sailing vessel was demasted and towed to safety,54.5,0.8,hullAndEngineAccessoryDamageType,hull damage,0.8 54.5
HullAndEngineAccessoryDamage,20221001,,0,0,0,A recreational sailing vessel was demasted and towed to safety,55.8228,-4.9673,hullAndEngineAccessoryDamageType,hull damage,-4.9673 55.8228
StrandingAndGrounding,20221001,,0,0,0,A recreational motor cruiser went aground and suffered water ingress,51.5174,0.7177,strandingAndGroundingType,grounding,0.7177 51.5174
HullAndEngineAccessoryDamage,20221001,,0,0,1,A sailing vessel was demasted and crew member injured,51.7545,0.9052,hullAndEngineAccessoryDamageType,hull damage,0.9052 51.7545
OtherIncident,20221001,,0,0,1,A crewmember of a sailing yacht sustained a neck injury,51.7567,0.8945,otherIncidentType,other incident,0.8945 51.7567
floodingAndSinking,20221001,,0,0,0,A recreational sailing vessel suffered water ingress,53.1533,-4.7583,floodingAndSinkingType,flooding,-4.7583 53.1533
NavigationalIssues,20221001,,0,0,0,A pleasure vessel became ensnared by an underwater obstruction (rope),56.454,-5.4648,navigationalIssuesType,sailing hinderance,-5.4648 56.454
floodingAndSinking,20221001,,0,0,0,"See MAIB investigation report, when available",59.245,-0.0667,floodingAndSinkingType,sinking,-0.0667 59.245
CollisionAndContact,20221001,,0,0,0,A pelagic trawler snagged its nets on the propeller of a cargo ship,50.0933,-5.0356,collisionAndContactType,contact,-5.0356 50.0933
HullAndEngineAccessoryDamage,20221001,,0,0,0,A container vessel had a non-SOLAS compliant pilot ladder arrangement.,51.4961,0.7767,hullAndEngineAccessoryDamageType,outfit damage,0.7767 51.4961
NavigationalIssues,20221001,,0,0,0,A sailing vessel experienced propulsion failure and was pushed into a harbor arm,50.8117,-0.108,navigationalIssuesType,drifting,-0.108 50.8117
OtherIncident,20221001,,0,1,0,"See MAIB investigation report, when available",51.9382,-14.8342,otherIncidentType,other incident,-14.8342 51.9382
HullAndEngineAccessoryDamage,20221001,,0,0,0,A dredger had a non-SOLAS compliant pilot ladder,55.0333,-1.3365,hullAndEngineAccessoryDamageType,outfit damage,-1.3365 55.0333
OtherIncident,20221001,,0,0,1,Cruise ship crewmember sustained facial injuries from assembling a metal sofa bed.,16.055,-156.766667,otherIncidentType,other incident,-156.766667 16.055
CollisionAndContact,20221001,,0,0,0,A lifeboat damaged its propeller after contact with a fender,54.4906,-3.6075,collisionAndContactType,contact,-3.6075 54.4906
OtherIncident,20221001,,0,0,1,Cruise ship crewmember suffered a carpal bone contusion after trapping hand in a fire screen door.,1.783333,-153.873333,otherIncidentType,other incident,-153.873333 1.783333
NavigationalIssues,20221001,,0,0,0,Fishing vessel fouled prop and was taken under tow by another fishing vessel.,55.8779,-2.0862,navigationalIssuesType,drifting,-2.0862 55.8779
CollisionAndContact,20221001,,0,0,0,Fishing vessel ran aground intentionally due to water ingress after hitting a submerged object.,55.1282,-1.4938,collisionAndContactType,collision,-1.4938 55.1282
FireAndExplosion,20221001,,0,0,0,A recreational sailing vessel caught fire and sank,56.0253,-4.7977,fireAndExplosionType,fire,-4.7977 56.0253
floodingAndSinking,20221001,,0,0,0,Motorboat took on water and were escorted to safety and then towed to a berth.,50.923,1.006667,floodingAndSinkingType,flooding,1.006667 50.923
NavigationalIssues,20221001,,0,0,0,Fishing vessel fouled their prop and became anchored to the sea bed. They were freed and towed to a marina.,51.530833,-3.889333,navigationalIssuesType,sailing hinderance,-3.889333 51.530833
NavigationalIssues,20221001,,0,0,0,Fishing vessel fouled its prop and was towed by another fishing vessel and assisted by ALB into harbour.,49.896167,-3.952167,navigationalIssuesType,drifting,-3.952167 49.896167
CollisionAndContact,20221001,,0,0,0,Fishing vessel and RNLI vessel collided during operations resulting in minor damage.,51.538333,-3.89,collisionAndContactType,collision,-3.89 51.538333
StrandingAndGrounding,20221001,,0,0,0,A search and rescue vessel grounded during a shoreline search resulting in minor damage.,50.802,-0.4986,strandingAndGroundingType,grounding,-0.4986 50.802
OtherIncident,20221001,,0,0,1,A passenger on a tour boat slipped and fell on stairs resulting in a minor head injury.,54.3632,-2.9229,otherIncidentType,other incident,-2.9229 54.3632
NavigationalIssues,20221001,,0,0,0,Offshore supply vessel fouled their prop on a mooring wire which had to be cut by an ROV vessel.,60.0505,-3.934667,navigationalIssuesType,sailing hinderance,-3.934667 60.0505
StrandingAndGrounding,20221001,,0,0,0,A search and rescue vessel hit a submerged object resulting in damage to the propellers and skegs.,52.9461,1.2125,strandingAndGroundingType,grounding,1.2125 52.9461
OtherIncident,20221001,,0,0,1,Fishing vessel crewmember fell overboard and was recovered while unconscious.,58.715,0.25805,otherIncidentType,other incident,0.25805 58.715
NavigationalIssues,20221001,,0,0,0,Crew transfer vessel lost propulsion in port engine and was towed by lifeboat into a ahrbour,56.106083,-3.116667,navigationalIssuesType,sailing hinderance,-3.116667 56.106083
FireAndExplosion,20221001,,0,0,0,A yacht suffered fire in engine space resulting in minor damage,50.7992,-1.4182,fireAndExplosionType,fire,-1.4182 50.7992
OtherIncident,20221001,,0,0,1,Cruise ship passenger went over on their ankle on the dancefloor and fractured it.,-22.173333,153.591667,otherIncidentType,other incident,153.591667 -22.173333
NavigationalIssues,20221001,,0,0,0,Fishing Vessel experienced engine issues and was towed back to harbour,57.8285,-1.716,navigationalIssuesType,drifting,-1.716 57.8285
OtherIncident,20221001,,0,0,1,A dredger crew member was injured when swinging out the lifeboat.,50.821667,-1.303,otherIncidentType,safety hinderance and near misses,-1.303 50.821667
HullAndEngineAccessoryDamage,20221001,,0,0,0,Sailing vessel blown from mooring and required assistance to re-moor.,53.3133,-4.626,hullAndEngineAccessoryDamageType,hull damage,-4.626 53.3133
NavigationalIssues,20221001,,0,0,0,Motor vessel propellers became fouled and assistance was required to free them,58.952,-3.3239,navigationalIssuesType,sailing hinderance,-3.3239 58.952
StrandingAndGrounding,20221001,,0,0,0,"See MAIB investigation report, when available",57.6809,-1.9416,strandingAndGroundingType,grounding,-1.9416 57.6809
NavigationalIssues,20221001,,0,0,0,Buoy-laying vessel suffered a blackout after the power management system failed.,51.2517,-3.8267,navigationalIssuesType,sailing hinderance,-3.8267 51.2517
CollisionAndContact,20221001,,0,0,0,A transfer vessel's wheelhouse window grazed by an offshore supply vessel's crane hook during lifting operations.,51.741667,2.798333,collisionAndContactType,collision,2.798333 51.741667
OtherIncident,20221001,,0,0,1,Cruise ship passenger injured their knee while playing football.,-24.4273,153.6945,otherIncidentType,other incident,153.6945 -24.4273
OtherIncident,20221001,,0,0,1,Cruise ship passenger fractured their wrist after a fall in their cabin.,-24.793333,153.631667,otherIncidentType,other incident,153.631667 -24.793333
NavigationalIssues,20221001,,0,0,0,Fishing vessel fouled its propeller and was towed to harbour.,53.156167,0.3725,navigationalIssuesType,drifting,0.3725 53.156167
OtherIncident,20221001,,0,0,1,Fishing vessel crewmember suffered a knife injury to their foot.,57.370667,-5.9025,otherIncidentType,other incident,-5.9025 57.370667
OtherIncident,20221001,,0,0,1,A cruise ship passenger fell in their bathroom,22.8867,-109.89,otherIncidentType,other incident,-109.89 22.8867
OtherIncident,20221001,,1,0,0,A hire boat customer went missing,54.4114,-7.6867,otherIncidentType,other incident,-7.6867 54.4114
CollisionAndContact,20221001,,0,0,0,Passenger vessel made contact with a moored passenger vessel resulting in damage and minor injuries.,51.5011,-0.0615,collisionAndContactType,collision,-0.0615 51.5011
OtherIncident,20221101,,0,0,1,Fishing vessel crewmember sustained a back crush injury.,61.091333,-0.917667,otherIncidentType,other incident,-0.917667 61.091333
floodingAndSinking,20221001,,0,0,0,A sailing vessel started to take on water in heavy weather,50.0633,-5.366733,floodingAndSinkingType,flooding,-5.366733 50.0633
OtherIncident,20221001,,0,0,1,Buoy-laying vessel crewmember sustained a finger injury while replacing lantern.,51.651667,1.966667,otherIncidentType,other incident,1.966667 51.651667
OtherIncident,20221001,,0,0,1,Recreational sailing vessel crewmember was evacuated from vessel following a head injury.,50.671,-1.732333,otherIncidentType,other incident,-1.732333 50.671
floodingAndSinking,20221001,,0,0,0,Fishing vessel was taking on water but managed to control ingress using pumps.,50.695167,-0.187833,floodingAndSinkingType,flooding,-0.187833 50.695167
HullAndEngineAccessoryDamage,20221001,,0,0,0,A container vessel had two unsafe pilot ladders,51.5033,0.6246,hullAndEngineAccessoryDamageType,outfit damage,0.6246 51.5033
OtherIncident,20221001,,0,0,1,A fisheries research vessel crewmember sustained a minor facial injury,50.155,-2.7667,otherIncidentType,other incident,-2.7667 50.155
OtherIncident,20221001,,0,0,1,A fisheries research vessel crewmember sustained a minor injury to leg,50.045,-4.65,otherIncidentType,other incident,-4.65 50.045
OtherIncident,20221001,,0,0,1,A crewmember of a jack up construction vessel suffered a finger amputation,56.255,-2.1683,otherIncidentType,other incident,-2.1683 56.255
HullAndEngineAccessoryDamage,20221101,,0,0,0,A general cargo vessel had a non-SOLAS compliant pilot ladder,51.4432,0.7923,hullAndEngineAccessoryDamageType,outfit damage,0.7923 51.4432
OtherIncident,20221001,,0,0,1,A SAR vessel crewmember sustained a back injury.,51.7882,-7.952,otherIncidentType,other incident,-7.952 51.7882
HullAndEngineAccessoryDamage,20221001,,0,0,0,A bulk carrier had a non-SOLAS compliant pilot ladder arrangement,53.5054,-3.1869,hullAndEngineAccessoryDamageType,outfit damage,-3.1869 53.5054
HullAndEngineAccessoryDamage,20221001,,0,0,0,A general cargo vessel had a non-SOLAS compliant pilot ladder,55.0132,-1.4001,hullAndEngineAccessoryDamageType,outfit damage,-1.4001 55.0132
NavigationalIssues,20221001,,0,0,0,Recreational sailing vessel lost engine power and was being blown ashore,51.9274,1.2747,navigationalIssuesType,sailing hinderance,1.2747 51.9274
HullAndEngineAccessoryDamage,20221001,,0,0,0,A crude oil tanker had a non-SOLAS compliant pilot ladder arrangement,51.5037,0.5713,hullAndEngineAccessoryDamageType,outfit damage,0.5713 51.5037
HullAndEngineAccessoryDamage,20221001,,0,0,0,A bulk carrier had an non-SOLAS compliant pilot ladder,53.5257,-3.2873,hullAndEngineAccessoryDamageType,outfit damage,-3.2873 53.5257
NavigationalIssues,20221001,,0,0,0,SAR craft was on exercise when it experienced engine failure and was towed back to station by another SAR asset,55.147667,-1.503833,navigationalIssuesType,drifting,-1.503833 55.147667
OtherIncident,20221101,,0,0,1,Fishing vessel crewmember sustained injuries after being pulled onto the net drum.,60.1843,-0.6143,otherIncidentType,other incident,-0.6143 60.1843
NavigationalIssues,20221101,,0,0,0,Fishing vessel fouled its propeller and was taken under tow to safety.,54.923933,-1.352283,navigationalIssuesType,drifting,-1.352283 54.923933
NavigationalIssues,20221101,,0,0,0,A fishing vessel experienced electrical issues after being hit by a large wave,50.2192,-6.2277,navigationalIssuesType,drifting,-6.2277 50.2192
