FeatureType,date,IMONum,deaths,missings,severeInjuries,description,latitude,longitude,subtype_field,subtype_value,gml_pos
HullAndEngineAccessoryDamage,20240901,,0,0,0,Tanker ship's pilot ladder did not conform to SOLAS regulations.,51.7006,-5.0414,hullAndEngineAccessoryDamageType,outfit damage,-5.0414 51.7006
HullAndEngineAccessoryDamage,20240901,,0,0,0,Tanker vessel's pilot ladder did not conform to SOLAS regulations.,51.702,-5.0692,hullAndEngineAccessoryDamageType,outfit damage,-5.0692 51.702
HullAndEngineAccessoryDamage,20241001,,0,0,0,Tanker vessel's pilot ladder did not conform to SOLAS regulations.,51.7096,-5.0369,hullAndEngineAccessoryDamageType,outfit damage,-5.0369 51.7096
HullAndEngineAccessoryDamage,20241001,,0,0,0,Tug had spring line that caught itself around its propeller and cleared,51.71,-5.0205,hullAndEngineAccessoryDamageType,machineries and propulsion damage,-5.0205 51.71
NavigationalIssues,20241001,,0,0,0,A pilot vessel experienced a steering issue,51.6994,-5.0995,navigationalIssuesType,loss of direction,-5.0995 51.6994
OtherIncident,20241001,,0,0,1,A SAR vessels crew member injured their knee whilst standing up.,51.703833,-5.050333,otherIncidentType,other incident,-5.050333 51.703833
OtherIncident,20240301,,0,0,1,"Cruise ship's passenger slipped on step resulting in injuries to the face, wrists, shoulder and knees.",-33.86,151.21,otherIncidentType,other incident,151.21 -33.86
OtherIncident,20240901,,0,0,1,A cruise ship passenger fell down two steps and fractured their arm.,-33.8591,151.2105,otherIncidentType,other incident,151.2105 -33.8591
NavigationalIssues,20240901,,0,0,0,"A cruise ship lost half propulsion, rectified and departed.",-33.853333,151.215,navigationalIssuesType,sailing hinderance,151.215 -33.853333
OtherIncident,20240101,,0,0,1,Pilot boat's crew member fell from the boat to the pontoon resulting in a fractured ankle.,57.506,-1.7709,otherIncidentType,other incident,-1.7709 57.506
NavigationalIssues,20240401,,0,0,0,General cargo vessel turned after leaving port & lost propulsion caused by issues with main engine fuel pump,50.155667,-5.053667,navigationalIssuesType,loss of direction,-5.053667 50.155667
FireAndExplosion,20240501,,0,0,0,A supply vessel experienced a fire in the engine room,57.495,-1.788333,fireAndExplosionType,fire,-1.788333 57.495
CollisionAndContact,20240501,,0,0,0,A search and rescue vessel made contact with a pontoon,57.5025,-1.7738,collisionAndContactType,contact,-1.7738 57.5025
NavigationalIssues,20240701,,0,0,0,Fishing vessel lost propulsion to main and aux engine resulting in tow back to mooring.,50.1565,-5.060167,navigationalIssuesType,drifting,-5.060167 50.1565
OtherIncident,20240801,,0,0,1,The derrick of a twin-rig trawler struck a shore worker during landing operations.,57.5068,-1.7713,otherIncidentType,safety hinderance and near misses,-1.7713 57.5068
OtherIncident,20240101,,0,0,1,Passenger Ro-Ro crew member slipped resulting in a dislocated knee,55.9401,-4.711,otherIncidentType,other incident,-4.711 55.9401
OtherIncident,20240801,,0,0,1,A cruise ship crew member sustained a traumatic amputation from a hatch falling on their finger.,55.955,-4.758333,otherIncidentType,safety hinderance and near misses,-4.758333 55.955
HullAndEngineAccessoryDamage,20240101,,0,0,0,Container ship's pilot ladder did not conform to SOLAS regulations,56.0229,-3.44,hullAndEngineAccessoryDamageType,outfit damage,-3.44 56.0229
CollisionAndContact,20240301,,0,0,0,A general cargo vessel made contact with the quayside.,56.0246,-3.4428,collisionAndContactType,collision,-3.4428 56.0246
CollisionAndContact,20240401,,0,0,0,"Cargo ship lost power resulting in damage to the bow, quayside and emergency escape ladder.",56.0189,-3.4479,collisionAndContactType,collision,-3.4479 56.0189
HullAndEngineAccessoryDamage,20240501,,0,0,0,A cargo vessel sustained minor damage while being towed,56.056667,-3.141667,hullAndEngineAccessoryDamageType,rudder damage,-3.141667 56.056667
FireAndExplosion,20241001,,0,0,0,A dredger suffered an electrical fire onboard resulting in minor damage,51.553317,-2.989117,fireAndExplosionType,fire,-2.989117 51.553317
NavigationalIssues,20241101,,0,0,0,A tug experienced an oil spill incident whilst taking bunkers.,51.5623,-2.9829,navigationalIssuesType,,-2.9829 51.5623
OtherIncident,20240401,,0,0,1,A passenger vessel crew member fell from scaffolding and dislocated their knee.,50.1201,-5.5305,otherIncidentType,other incident,-5.5305 50.1201
OtherIncident,20240801,,0,0,0,A passenger vessel crew member fell overboard.,50.7058,-1.5036,otherIncidentType,safety hinderance and near misses,-1.5036 50.7058
OtherIncident,20240101,,0,0,1,Motorcyclist sustained injuries on a ferry while the vehicles were unloading,50.7345,-1.2132,otherIncidentType,other incident,-1.2132 50.7345
OtherIncident,20240501,,0,0,1,A single handed dinghy capsized and the occupant went overboard.,50.81359,-1.13524,otherIncidentType,other incident,-1.13524 50.81359
OtherIncident,20240801,,0,0,1,Recreational craft struck swimmer resulting in injuries to the head and shoulders.,51.8737,-5.1895,otherIncidentType,other incident,-5.1895 51.8737
CollisionAndContact,20240901,,0,0,0,A cargo vessel collided with a pilot vessel resulting in the pilot vessel sinking,31.168333,29.85,collisionAndContactType,collision,29.85 31.168333
CollisionAndContact,20240101,,0,0,0,A search and rescue vessel made contact with the gangway resulting in minor damage,52.5808,1.732,collisionAndContactType,collision,1.732 52.5808
HullAndEngineAccessoryDamage,20240401,,0,0,0,Container ship's pilot ladder did not conform to SOLAS regulations.,52.5833,1.7303,hullAndEngineAccessoryDamageType,outfit damage,1.7303 52.5833
HullAndEngineAccessoryDamage,20240401,,0,0,0,Container ship's pilot ladder did not conform to SOLAS regulations.,52.6109,1.7187,hullAndEngineAccessoryDamageType,outfit damage,1.7187 52.6109
HullAndEngineAccessoryDamage,20240401,,0,0,0,Offshore support vessel's pilot ladder did not conform to SOLAS regulations.,52.6103,1.7192,hullAndEngineAccessoryDamageType,outfit damage,1.7192 52.6103
HullAndEngineAccessoryDamage,20240701,,0,0,0,Offshore supply vessel's pilot ladder did not conform to SOLAS regulations.,52.5722,1.7412,hullAndEngineAccessoryDamageType,outfit damage,1.7412 52.5722
HullAndEngineAccessoryDamage,20240901,,0,0,0,Offshore supply vessel's pilot ladder did not conform to SOLAS regulations.,52.5771,1.7408,hullAndEngineAccessoryDamageType,outfit damage,1.7408 52.5771
OtherIncident,20241101,,0,0,1,A cruise ship's passenger lost there footing and fell resulting in a closed fracture to the hip.,18.011667,-63.048333,otherIncidentType,other incident,-63.048333 18.011667
OtherIncident,20240901,,0,0,1,A cruise ship crew member hurt their back whilst making a bed,35.0341,138.5021,otherIncidentType,other incident,138.5021 35.0341
OtherIncident,20241101,,0,0,1,A crew transfer vessel crew member slipped on an icy deck and sustained a fractured wrist,58.4403,-3.0858,otherIncidentType,safety hinderance and near misses,-3.0858 58.4403
OtherIncident,20240201,,0,0,1,Fishing vessel crew member's hand got trapped resulting in a closed fracture,52.4656,4.6202,otherIncidentType,other incident,4.6202 52.4656
OtherIncident,20240101,,0,0,1,A general cargo vessel crewmember fell and injured their ankle.,57.68,-2.9561,otherIncidentType,other incident,-2.9561 57.68
StrandingAndGrounding,20240201,,0,0,0,A tug partially grounded in a channel,51.116783,1.312417,strandingAndGroundingType,grounding,1.312417 51.116783
StrandingAndGrounding,20240201,,0,0,0,Cargo ship grounded while coming in to port,57.680217,-2.961817,strandingAndGroundingType,grounding,-2.961817 57.680217
CollisionAndContact,20240201,,0,0,0,Cargo vessel made contact with quayside whilst approaching its berth,57.68015,-2.960717,collisionAndContactType,contact,-2.960717 57.68015
NavigationalIssues,20240301,,0,0,0,A ro-pax vessel experienced steering failure whilst departing from a port.,51.1216,1.3421,navigationalIssuesType,loss of direction,1.3421 51.1216
NavigationalIssues,20240401,,0,0,0,A ro-pax vessel engine room crane failed causing an engine part to fall.,50.978333,1.871667,navigationalIssuesType,drifting,1.871667 50.978333
OtherIncident,20240601,,0,0,1,A visitor to a harbour dredger fell and sustained a fractured wrist.,57.68055,-2.954367,otherIncidentType,other incident,-2.954367 57.68055
OtherIncident,20240601,,0,0,1,A single handed dinghy crew member fell overboard and was recovered.,50.8579,-1.3116,otherIncidentType,other incident,-1.3116 50.8579
OtherIncident,20240701,,0,0,1,Passenger/Ro-Ro crew member injured back when lifting,51.127,1.3372,otherIncidentType,other incident,1.3372 51.127
OtherIncident,20240701,,0,0,1,The injured person was undertaking MES Chute training on board,51.1218,1.3172,otherIncidentType,safety hinderance and near misses,1.3172 51.1218
OtherIncident,20240801,,0,0,1,RoPax crew member caught thumb while carrying out maintenance resulting in minor injury.,51.124083,1.3353,otherIncidentType,other incident,1.3353 51.124083
HullAndEngineAccessoryDamage,20240801,,0,0,0,Container ship's pilot ladder did not conform to SOLAS regulations.,51.1214,1.3185,hullAndEngineAccessoryDamageType,outfit damage,1.3185 51.1214
OtherIncident,20240901,,0,0,0,Service vessels crew member tripped resulting in person over board,51.117833,1.326333,otherIncidentType,safety hinderance and near misses,1.326333 51.117833
OtherIncident,20241101,,0,0,1,A pilot vessel crew member dislocated their ankle whilst disembarking the vessel.,51.1186,1.3155,otherIncidentType,other incident,1.3155 51.1186
CollisionAndContact,20240901,,0,0,0,"A sailing vessel made contact with a pier, two crew were recovered and the vessel later sank",50.608367,-1.948217,collisionAndContactType,contact,-1.948217 50.608367
OtherIncident,20241001,,0,0,1,A sailing yacht crew member fell and sustained a head injury,50.3723,-4.1944,otherIncidentType,other incident,-4.1944 50.3723
CollisionAndContact,20240301,,0,0,0,A tug and an offshore supply vessel collided during manoeuvring operations.,55.9851,-3.1774,collisionAndContactType,collision,-3.1774 55.9851
OtherIncident,20240501,,0,0,1,A cruise ship passenger fell and fractured their shoulder,21.3,-157.866667,otherIncidentType,other incident,-157.866667 21.3
HullAndEngineAccessoryDamage,20240501,,0,0,0,Oil tanker's pilot ladder did not conform to SOLAS regulations.,53.3777,-2.9983,hullAndEngineAccessoryDamageType,outfit damage,-2.9983 53.3777
FireAndExplosion,20240101,,0,0,0,General cargo vessel suffered a fire in the cargo hold resulting in minor damage.,51.5528,-2.9708,fireAndExplosionType,fire,-2.9708 51.5528
CollisionAndContact,20240201,,0,0,0,Tug made contact with a lock gate resulting no damage,51.5514,-2.9773,collisionAndContactType,contact,-2.9773 51.5514
CollisionAndContact,20240501,,0,0,0,A racing yacht struck a submerged floating object.,36.73335,15.122933,collisionAndContactType,collision,15.122933 36.73335
NavigationalIssues,20240101,,0,0,0,A dredger experienced propulsion failure whilst in a lock using the bridge wing controls.,53.629833,-0.188833,navigationalIssuesType,loss of direction,-0.188833 53.629833
HullAndEngineAccessoryDamage,20240101,,0,0,0,Ro-Ro cargo vessel was berthing when it damaged the fender.,53.6273,-0.191,hullAndEngineAccessoryDamageType,hull damage,-0.191 53.6273
OtherIncident,20240301,,0,0,1,Line boat crew member injured wrist resulting in closed fracture,53.6308,-0.1883,otherIncidentType,other incident,-0.1883 53.6308
CollisionAndContact,20240301,,0,0,0,A ro-ro vessel made contact with a shore structure whilst transiting a lock.,53.629,-0.19,collisionAndContactType,contact,-0.19 53.629
OtherIncident,20240301,,0,0,1,A general cargo vessel crew member suffered a crush injury.,53.633,-0.1855,otherIncidentType,other incident,-0.1855 53.633
OtherIncident,20240301,,0,0,1,Passenger ships crew member fell from bunk ladder resulting in closed fractures to the hand.,13.1093,-59.629,otherIncidentType,other incident,-59.629 13.1093
NavigationalIssues,20240501,,0,0,0,A cargo vessel experienced control pitch propeller failure and had to drop anchor,53.628333,-0.193333,navigationalIssuesType,sailing hinderance,-0.193333 53.628333
CollisionAndContact,20240601,,0,0,0,A container vessel made contact with the quay whilst entering a lock.,53.6285,-0.1905,collisionAndContactType,contact,-0.1905 53.6285
CollisionAndContact,20240601,,0,0,0,A container vessel made contact with the quay during arrival at port.,53.631,-0.187,collisionAndContactType,contact,-0.187 53.631
CollisionAndContact,20240701,,0,0,0,A ro-ro cargo vessel made contact with a gate whilst transiting a lock,53.6285,-0.1905,collisionAndContactType,contact,-0.1905 53.6285
HullAndEngineAccessoryDamage,20240801,,0,0,0,Bulk carrier used non-conforming heaving line,53.6645,-0.2276,hullAndEngineAccessoryDamageType,outfit damage,-0.2276 53.6645
CollisionAndContact,20240901,,0,0,0,A cargo ship made contact with a quay whilst coming alongside,53.6359,-0.1981,collisionAndContactType,contact,-0.1981 53.6359
CollisionAndContact,20240901,,0,0,0,A ro-ro cargo vessel made contact with the edge of a lock causing damage to the lock.,53.631,-0.187,collisionAndContactType,contact,-0.187 53.631
CollisionAndContact,20241001,,0,0,0,A container ship was entering a lock and made contact with a lock gate,53.6306,-0.188,collisionAndContactType,collision,-0.188 53.6306
CollisionAndContact,20241001,,0,0,0,A tug made contact with a general cargo vessel whilst in a lock,53.6297,-0.1891,collisionAndContactType,contact,-0.1891 53.6297
CollisionAndContact,20241001,,0,0,0,A cargo vessel sustained a hole in the cargo hold from a shore grab,53.6264,-0.19,collisionAndContactType,contact,-0.19 53.6264
OtherIncident,20241101,,0,0,1,A cruise ship passenger slipped and fell and sustained a fractured coccyx,13.101667,-59.628333,otherIncidentType,other incident,-59.628333 13.101667
HullAndEngineAccessoryDamage,20241101,,0,0,0,A general cargo vessel used an unsafely weighted heaving line.,53.6278,-0.1972,hullAndEngineAccessoryDamageType,outfit damage,-0.1972 53.6278
FireAndExplosion,20241001,,0,0,0,A cruise ship experienced a fire caused by a battery cell together with garbage.,17.12,-61.85,fireAndExplosionType,fire,-61.85 17.12
StrandingAndGrounding,20240901,,0,0,0,A fishing vessel grounded on a submerged rock ledge and required assistance,54.261117,-5.599717,strandingAndGroundingType,grounding,-5.599717 54.261117
OtherIncident,20241001,,0,0,1,A cruise ship crew member was using a knife resulting in a laceration injury,-35.0433,174.5983,otherIncidentType,safety hinderance and near misses,174.5983 -35.0433
NavigationalIssues,20240101,,0,0,0,A general cargo vessel dropped a hatch cover being moved by the onboard gantry crane.,57.115,12.238333,navigationalIssuesType,drifting,12.238333 57.115
NavigationalIssues,20240701,,0,0,0,A landing craft was caught by the wake of a passing ro-pax vessel resulting in minor damage.,57.7666,-7.0254,navigationalIssuesType,sailing hinderance,-7.0254 57.7666
CollisionAndContact,20240801,,0,0,0,A general cargo vessel made contact with a quay as it was entering a port,57.1177,12.2361,collisionAndContactType,contact,12.2361 57.1177
OtherIncident,20240101,,0,0,1,A cruise ship passenger fell in the shower and fractured their shoulder.,-34.578333,-58.37,otherIncidentType,other incident,-92.948333
OtherIncident,20240201,,0,0,1,Cruise ship guest tripped resulting in an injury to the hip.,-34.5946,-58.3628,otherIncidentType,other incident,-92.9574
HullAndEngineAccessoryDamage,20240401,,0,0,0,Container ship's pilot ladder did not conform to SOLAS regulations.,51.4452,0.751,hullAndEngineAccessoryDamageType,outfit damage,0.751 51.4452
OtherIncident,20240901,,0,0,1,Cruise ships crew member tripped resulting in closed fracture to the right hand.,28.1371,-15.4189,otherIncidentType,other incident,-15.4189 28.1371
OtherIncident,20240901,,0,0,1,Cruise ships passenger tripped resulting in dislocated shoulder.,28.1261,-15.4056,otherIncidentType,other incident,-15.4056 28.1261
OtherIncident,20241001,,0,0,1,A cruise ship passenger fell down a set of steps resulting in a fractured arm,28.14,-15.423333,otherIncidentType,safety hinderance and near misses,-15.423333 28.14
HullAndEngineAccessoryDamage,20241101,,0,0,0,General cargo vessel's pilot ladder did not conform to SOLAS regulations.,51.3997,0.6306,hullAndEngineAccessoryDamageType,outfit damage,0.6306 51.3997
HullAndEngineAccessoryDamage,20241201,,0,0,0,Bulk carrier's pilot ladder did not conform to SOLAS regulations,51.3889,0.7527,hullAndEngineAccessoryDamageType,outfit damage,0.7527 51.3889
OtherIncident,20240201,,0,0,1,"Cargo ship's crew member was struck by head line, resulting in closed fractures injuries to the hand and chest.",51.4547,0.3489,otherIncidentType,other incident,0.3489 51.4547
CollisionAndContact,20240201,,0,0,0,Passenger ferry crew member misjudged approach & collided with a moored crew supply vessel,51.453,0.337533,collisionAndContactType,collision,0.337533 51.453
HullAndEngineAccessoryDamage,20240401,,0,0,0,A container vessel had an inadequate pilot ladder arrangement.,51.4533,0.3346,hullAndEngineAccessoryDamageType,hull damage,0.3346 51.4533
OtherIncident,20240601,,0,0,1,A workboat crew member fell and fractured their ankle.,51.4534,0.3451,otherIncidentType,safety hinderance and near misses,0.3451 51.4534
HullAndEngineAccessoryDamage,20240701,,0,0,0,Container ship's pilot ladder did not conform to SOLAS regulations.,51.4987,0.875,hullAndEngineAccessoryDamageType,outfit damage,0.875 51.4987
CollisionAndContact,20240801,,0,0,0,Ro-cargo vessel made contact with jetty and was holed above the waterline,51.4548,0.3386,collisionAndContactType,collision,0.3386 51.4548
HullAndEngineAccessoryDamage,20240801,,0,0,0,Bulk ship's pilot ladder did not conform to SOLAS regulations.,51.454,0.3346,hullAndEngineAccessoryDamageType,outfit damage,0.3346 51.454
HullAndEngineAccessoryDamage,20240801,,0,0,0,A general cargo vessel had an inadequate pilot ladder arrangement.,51.4498,0.354,hullAndEngineAccessoryDamageType,outfit damage,0.354 51.4498
HullAndEngineAccessoryDamage,20240901,,0,0,0,Ro-Ro cargo ship's pilot ladder did not conform to SOLAS regulations.,51.4546,0.3359,hullAndEngineAccessoryDamageType,outfit damage,0.3359 51.4546
OtherIncident,20240801,,0,0,1,Cargo vessels crew member slipped resulting in twisted ankle.,1.463333,103.833333,otherIncidentType,safety hinderance and near misses,103.833333 1.463333
OtherIncident,20241001,,0,0,2,Barge crew members attempted to move several steel plates by hand without any appropriate equipment and two were injured.,51.459,0.3519,otherIncidentType,safety hinderance and near misses,0.3519 51.459
OtherIncident,20241201,,0,0,1,A tug crew member pulled their leg muscle whilst working.,51.505333,0.5166,otherIncidentType,safety hinderance and near misses,0.5166 51.505333
CollisionAndContact,20240301,,0,0,0,Oil tanker collided with bulk carrier while at anchor resulting in damage to the bow.,1.2864,103.8666,collisionAndContactType,collision,103.8666 1.2864
NavigationalIssues,20241001,,0,0,0,"Inland waterway ferry experienced power failure, struck the quay and accidentally activated their CO2 fire suppression system.",55.0002,-1.4403,navigationalIssuesType,sailing hinderance,-1.4403 55.0002
OtherIncident,20240401,,0,0,1,"A pilot boat passenger transferred onto a tug, tripped on mooring wire, resulting in fractured elbows",51.690833,-4.956667,otherIncidentType,other incident,-4.956667 51.690833
OtherIncident,20240701,,0,0,1,A bulk carrier crew member slipped and fell off piping resulting in a vertebra fracture,37.4687,126.5846,otherIncidentType,other incident,126.5846 37.4687
FireAndExplosion,20241001,,0,0,0,A cargo vessel experienced a fire in there hold unknow cause,51.5047,-2.7062,fireAndExplosionType,fire,-2.7062 51.5047
NavigationalIssues,20241001,,0,0,0,A private motor yacht experienced a steering failure as a result of a power short on a generator.,43.2943,6.6677,navigationalIssuesType,sailing hinderance,6.6677 43.2943
FireAndExplosion,20241001,,0,0,0,A service vessel experienced a fire pump starter failure due to a loose electrical connection,36.133,-5.3644,fireAndExplosionType,fire,-5.3644 36.133
OtherIncident,20241201,,0,0,1,A service vessel crew member lost their balance and sustained a shoulder injury,36.1303,-5.3556,otherIncidentType,safety hinderance and near misses,-5.3556 36.1303
OtherIncident,20241201,,0,0,1,A service vessel crew member was placing an open tin down when liquid splashed into their eye,36.1304,-5.3556,otherIncidentType,safety hinderance and near misses,-5.3556 36.1304
CollisionAndContact,20240201,,0,0,0,A search and rescue vessel caught on a fresh water hose resulting in damage to propeller blades.,50.4166,-5.0866,collisionAndContactType,contact,-5.0866 50.4166
OtherIncident,20240701,,0,0,1,A bulk carrier crew member sustained an eye injury whilst carrying out repair work,6.7815,-58.1749,otherIncidentType,other incident,-58.1749 6.7815
HullAndEngineAccessoryDamage,20240101,,0,0,0,General cargo's pilot ladder did not conform to SOLAS regulations,50.3348,-4.6343,hullAndEngineAccessoryDamageType,outfit damage,-4.6343 50.3348
HullAndEngineAccessoryDamage,20241001,,0,0,0,Cargo ship's pilot ladder did not conform to SOLAS regulations.,50.3334,-4.6362,hullAndEngineAccessoryDamageType,outfit damage,-4.6362 50.3334
OtherIncident,20240101,,0,0,1,Ro-Ro passenger ship's crew member tripped resulting in a sprained ankle,58.6121,-3.5479,otherIncidentType,other incident,-3.5479 58.6121
HullAndEngineAccessoryDamage,20231201,,0,0,0,"A container vessel was manoeuvring with a tug fast aft, when a Panama fairlead sheared from the deck.",51.9578,1.2995,hullAndEngineAccessoryDamageType,hull damage,1.2995 51.9578
OtherIncident,20240701,,0,0,1,A tug crew member was electrocuted whilst working in the vessel's workshop.,51.950333,1.314,otherIncidentType,other incident,1.314 51.950333
NavigationalIssues,20240701,,0,0,0,A container vessel whilst alongside lost two containers overboard that were later recovered,51.9486,1.3136,navigationalIssuesType,drifting,1.3136 51.9486
StrandingAndGrounding,20240701,,0,0,0,A recreational motor vessel ran aground.,54.616,-1.054,strandingAndGroundingType,grounding,-1.054 54.616
NavigationalIssues,20241001,,0,0,0,A container vessel had an oil spill whilst blowing the lines after bunkering.,40.6775,-74.1444,navigationalIssuesType,drifting,-74.1444 40.6775
OtherIncident,20241001,,0,0,1,A replenishment tanker crew member sustained a back injury whilst lifting a liferaft,56.0562,-4.8206,otherIncidentType,other incident,-4.8206 56.0562
OtherIncident,20240701,,0,0,1,Fishing vessel crew member amputated one finger after getting it caught in a rope,50.608,-2.445,otherIncidentType,other incident,-2.445 50.608
OtherIncident,20241001,,0,0,1,A cruise ships passenger fell on deck whilst taking photos resulting in a closed fracture to the hand.,20.655,-105.243333,otherIncidentType,other incident,-105.243333 20.655
OtherIncident,20241201,,0,0,1,A cruise ships passenger twisted ankle while playing pickleball.,20.658333,-105.243333,otherIncidentType,other incident,-105.243333 20.658333
HullAndEngineAccessoryDamage,20240401,,0,0,0,A trailing suction hopper dredger crew used an unsafely weighted heaving line.,52.4753,1.759,hullAndEngineAccessoryDamageType,machineries and propulsion damage,1.759 52.4753
HullAndEngineAccessoryDamage,20240501,,0,0,0,Davit winch on a cruise ship had an electrical defect during routine maintenance,-12.473333,130.845,hullAndEngineAccessoryDamageType,machineries and propulsion damage,130.845 -12.473333
HullAndEngineAccessoryDamage,20240701,,0,0,0,Dangerously weighted heaving line.,52.4746,1.7333,hullAndEngineAccessoryDamageType,machineries and propulsion damage,1.7333 52.4746
HullAndEngineAccessoryDamage,20240901,,0,0,0,An anchor handling tug crew used an unsafely weighted heaving line.,52.4756,1.7297,hullAndEngineAccessoryDamageType,machineries and propulsion damage,1.7297 52.4756
HullAndEngineAccessoryDamage,20241001,,0,0,0,A service vessel used a dangerously weighted heaving line,52.4732,1.746,hullAndEngineAccessoryDamageType,machineries and propulsion damage,1.746 52.4732
HullAndEngineAccessoryDamage,20241001,,0,0,0,A utility vessel crew member used an unsafely weighted heaving line.,52.4751,1.7552,hullAndEngineAccessoryDamageType,outfit damage,1.7552 52.4751
OtherIncident,20241001,,0,0,1,A cruise ship passenger fell and sustained a fractured toe.,35.8897,14.5091,otherIncidentType,other incident,14.5091 35.8897
NavigationalIssues,20241101,,0,0,0,Offshore supply vessel lost propulsion resulting in near miss with nearby berthed vessels.,52.4731,1.7418,navigationalIssuesType,drifting,1.7418 52.4731
NavigationalIssues,20241201,,0,0,0,A replenishment tanker experienced an oil spill incident,50.384483,-4.188783,navigationalIssuesType,drifting,-4.188783 50.384483
FireAndExplosion,20240601,,0,0,0,A pleasure yacht had a fire on board that was extinguished without significant damage.,50.756783,-1.290933,fireAndExplosionType,fire,-1.290933 50.756783
OtherIncident,20240601,,0,0,1,A water taxi passenger fell and broke their ankle.,50.765,-1.297,otherIncidentType,other incident,-1.297 50.765
OtherIncident,20220801,,0,0,1,A sail training vessel crew member threw an unsafely weighted heaving line which struck a member of the public.,51.532,0.7161,otherIncidentType,safety hinderance and near misses,0.7161 51.532
CollisionAndContact,20240701,,0,0,0,A sailing vessel got caught on the chains of a floating bridge.,50.7575,-1.2906,collisionAndContactType,contact,-1.2906 50.7575
OtherIncident,20241101,,0,0,1,"See MAIB investigation report, when available",50.7609,-1.2928,otherIncidentType,other incident,-1.2928 50.7609
