Reference,NumberOfShipsInvolved,ShipsInvolved,SOLASStatus,FlagStates,IncidentDateTime,TypeOfCasualty,Coordinates,Location,NumberOfInvestigationReports,NumberOfAnalyses,InitialEvent,SummaryOfEvents,ShipType1,Consequences1,GrossTonnage1,ClassificationSociety1,Deadweight1,Cargo1,CrewOnboard1,PassengersOnboard1,OthersOnboard1,DeadMissingCrew2,DeadMissingPassengers2,DeadMissingOthers3,SeriouslyInjuredCrew2,SeriouslyInjuredPassengers2,SeriouslyInjuredOthers2,InvestationReportDate,AnalysisDate
"C0013685","1","RAMONA (-)","RAMONA: Unknown/unspecified","DEU","2021-09-21 10:26","Very serious","540130N 0082629E","Open sea","1","0","Fire or explosion","The RAMONA sank in the Elbe estuary / Groer Vogelsand after a water inrush caused by loosened planks. The fishing vessel was on a research trip with 2 crew members and 3 scientists on board. All persons were able to save themselves in a life raft and were picked up by the fishing cutter HOFFNUNG. The ships rushed to help, including the rescue cruiser ANNELIESE KRAMER, were unable to prevent the RAMONA from sinking.","Fish Catching Vessel","Ship rendered unfit to proceed","33","","","","2","0","3","0","0","0","0","0","0","2022-12-28",""
"C0013316","1","VERA SU (IMO 8611219)","VERA SU: SOLAS","PAN","2021-09-20 04:14","Serious","431200N 0275200E","Black Sea","1","0","Stranding / grounding","At 04:14 LT on 20 Sept. 2021 m/v VERA SU ran aground on Bulgarian coast in Yailata protected area. The ship was en route from port Yuzhniy, Ukraine to Varna, Bulgaria. No injured people. The hull is said to be breached, no risk of pollution of environment.","General Cargo Ship","Ship rendered unfit to proceed","1984","Indian Register of Shipping (IRS)","3217","","7","0","0","[Primary Annex 2 not designated]","[Primary Annex 2 not designated]","[Primary Annex 2 not designated]","[Primary Annex 2 not designated]","[Primary Annex 2 not designated]","[Primary Annex 2 not designated]","2022-09-14",""
"C0013788","1","SAFINA (IMO 8611219)","SAFINA: SOLAS","COM","2021-09-20 04:13","Very serious","432592N 0283234E","Yailata rocky area, Bulgaria. ","1","0","Stranding / grounding","       M/V VERA SU has departed from Pivdennyi, Ukraine to Varna, Bulgaria on 18.09.2021 20.05lt with 2837.201MT urea prilled in bulk as per cargo manifest and 26.641MT ballast, 28.70MT diesel Oil, 3.80MT lube oil as per draft survey report. 9 crew member including master were on board according to the crew list.
     On 19.09.2021 at 23.50lt, 2nd D/O was taken over the watch from the master. The course altered to 247° at 01.55lt on GPS pos 43° 32’ 05” N - 028° 53’ 16” E. At this point it must be highlighted that 2nd D/O was alone on bridge during watch, BNWAS is not operational (Off) and the approved passage plan was not in use, the plan has changed verbally between master and officers. 2nd D/O felt asleep due to felt tired while waiting next WP to alter course to Varna separation scheme.
   The vessel grounding with full ahead around 7.8kts from forward part on 20.09.2021 at 04.13lt on Yailata rocky area, Bulgaria. (Gps position 43° 25.92’ N - 028° 32.34’ E) At that time weather condition recorded as wind direction NW, wind force 3, visibility good (5-6) and sea condition was moderate.
    After grounding, Master together with C/O came to bridge (on about 04.15lt), in order to check what happened and to evaluate overall vessel condition, then Master, as per company SMS Chap. 12 section 12.1.4.2.1 procedures, officially informed local authorities (Varna VTS, Varna MRCC) and the company about the incident. Also deck crew members were instructed to check ballast tanks by taken soundings, and visual inspection conducted around ship. Master tried to refloat the ship by using main engine ahead and astern, but without success then order to stop M/E, steering gear was placed in midship position. At this point it must be highlighted that C/O was late to his watch on bridge. There were no crew fatalities, oil spill nor any other kind of pollution reported.
","General Cargo Ship","Ship rendered unfit to proceed","1984","","3217","","9","","","[Primary Annex 2 not designated]","[Primary Annex 2 not designated]","[Primary Annex 2 not designated]","[Primary Annex 2 not designated]","[Primary Annex 2 not designated]","[Primary Annex 2 not designated]","2023-03-24",""
"C0013633","1","RIO CARABELAS (-)","RIO CARABELAS: Non-SOLAS","ARG","2021-09-16 19:50","Serious","341600S 0580100W","Aguas Interiores, Tigre, Primera Sección de Islas del Delta, Arroyo Caraguatá, Canal Gobernador Aria","0","0","Fire or explosion","El 16 de septiembre de 2021 la lancha de pasajeros tipo colectivo L/M “RIO CARABELAS”, bandera argentina, amarró a muelle sobre el arroyo Caraguata, próximo a la intersección con el Canal Gobernador Arias. A las 19:50 horas, durante el alistamiento de la lancha previo a la zarpada, se produjo un incendio a bordo. Como consecuencia del suceso se ocasionaron daños materiales serios en la embarcación.","","Total loss of the ship","14","[Flag Administration]","","","","","","[Primary Annex 2 not designated]","[Primary Annex 2 not designated]","[Primary Annex 2 not designated]","[Primary Annex 2 not designated]","[Primary Annex 2 not designated]","[Primary Annex 2 not designated]","",""
"C0013531","2","LISA AUERBACH (IMO 9388900), MY AN 1 (IMO 9060728)","LISA AUERBACH: Unknown/unspecified, MY AN 1: SOLAS","LBR,VNM","2021-09-14 02:24","Very serious","101250N 1070160E","Vung Tau, Vietnam ","1","0","Collision","The M.V. Lisa Auerbach arrived at Vung Tau, Vietnam anchorage on September 13, 2021 at 1224 LT. The master informed the Investigator that the Pilot boarding was scheduled for  September 14, 2021 at 0400 LT. The Vung Tau VTS confirmed pilot boarding time was 0400LT on September 14, 2021 at buoy No. 5. 
At 0212LT on September 14, 2021, the M.V. Lisa Auerbach heaved up the Starboard anchor, and proceeded to pick up the pilot, while the Lisa Auerbach was approaching buoy No.5, the Bosun at the forward station, reported an object ahead without any lights. The Bosun further stated the distance to the object was closing. The speed of the Lisa Auerbach was 11.1 kts.  The object was later found to be the anchored vessel M.V. My An 1. The M.V. Lisa Auerbach collided with the M.V. MV My An 1 on her Starboard side at 0224 LT on 14 September 2021 and the M.V. My An 1 sank. The master of the  Lisa Auerbach immediately reported to Vung Tau VTS and port control  the collision and commenced Search and Rescue (SAR) operations. A total of 13 crewmembers and 4 passengers were successfully rescued from the M.V. My An 1.","General Cargo Ship","Total loss of the ship","4988","Vietnam Register (VR)","8232","","","","","[Primary Annex 2 not designated]","[Primary Annex 2 not designated]","[Primary Annex 2 not designated]","[Primary Annex 2 not designated]","[Primary Annex 2 not designated]","[Primary Annex 2 not designated]","2023-03-27",""
"C0013539","1","SAMUS SWAN (IMO 9401312)","SAMUS SWAN: SOLAS","MLT","2021-09-11 13:47","Very serious","364500N 0124300E","Strait of Sicily 37 miles E of Pantelleria","2","1","Fire or explosion","Caught fire in the engine room and disabled whilst underway in the strait of Sicily 37 miles E of Pantelleria. Blaze extinguished by crew. Extent of damage was unknown. Two crew sustained injuries, one of whom was airlifted ashore by helicopter for medical attention. The 2 crew subsequently died. Nearby mv ASL Grace attended the scene. Subsequently taken in tow by AHTS Carlo Magno later the same evening to Augusta, Italy for inspection and repairs.","Chemical Tanker","Loss of life,Serious injuries,Ship rendered unfit to proceed","4001","[Other]","5717","","15","0","0","2","","","","","","2022-09-16","2023-02-20"
"C0013847","1","ARAFURA (IMO 9728708)","ARAFURA: Unknown/unspecified","BEL","2021-09-11 09:53","Very serious","561019S 0700440W","Open sea","2","0","","Two-seafarers deceased, due to hit by a seawave of abnormal height, which resulted in their deaths, on board the ship mts ARAFURA ( IMO No; 9728708) while the ship was enroute to Long Beach from Brazil.","Oil Tanker","Loss of life","154163","","298991","","23","0","","2","0","0","0","0","0","2023-08-01",""
"C0013336","1","ESRA C (IMO 9379662)","ESRA C: SOLAS","PAN","2021-09-08 14:00","Very serious","404629N 0293090E","Beldeport, Diliskelesi, Dilovası/Kocaeli, Turkey","1","1","Struck by an object","During the unloading operation of Panama registered bulk carrier ESRA C, at 08th of September 2021 around 14:00 LT (GMT+3) laden block cargo fell over a Turkish citizen shore worker in cargo hold number 4. Unfortunately, after a while the shore worker passed away.","Bulk Carrier","Loss of life","19825","RINA Services S.p.A (RINA)","31890","","","","","[Primary Annex 2 not designated]","[Primary Annex 2 not designated]","[Primary Annex 2 not designated]","[Primary Annex 2 not designated]","[Primary Annex 2 not designated]","[Primary Annex 2 not designated]","2022-08-03","2023-02-20"
"C0013586","1","L'AMI SINCERE (-)","L'AMI SINCERE: Unknown/unspecified","FRA","2021-09-08 00:00","Very serious","494183N 0003431W","Open sea","2","0","","On September 08, 2021, in the early morning, L'AMI SINCERE leaves the port of Grandcamp-Maisy, for fishing. A person, without qualification or professional certificate, is embarked in place of an absent sailor. During a trap launching manouver, this person was swept overboard. Attempts to rescue the man overboard failed, and the victim was pronounced dead by drowning.","Fish Catching Vessel","Loss of life","10.35","","","","","0","","1","0","0","0","0","0","2022-07-13",""
"C0013575","1","MANDARIN HANTONG (IMO 9569956)","MANDARIN HANTONG: SOLAS","LBR","2021-09-02 13:20","Very serious"," ","Gabon","1","0","Occupational accident","On September 02, 2021 about 1320 LT, while the vessel completed her cargo loading operation at Owendo anchorage, Gabon, position Lat 00-17.0 N Long 009-25.8 E, the Able Seafarer (AB) who just had completed his 0800~1200 duty was assigned to secure the cargo crane No.2 and secure the electrical cable for No.1 crane/grab by Bosun at about 1250 LT with Cadet’s assistance. After lowering the crane jib to the secure position of crane No.2 the victim AB climbed down from crane No.2 emergency access of the crane cabin to the crane middle platform in order to proceed to secure the electrical cable for No.1 cargo crane. While the victim AB climbed down, he fell onto the cross deck After part of the cargo hold No.1. The victim AB was found lying head down against the hydraulic pipes, unconscious with a weak pulse and bleeding from his left ear. The Master contacted the local agent for medical assistance and administered the oxygen. The victim AB was lowered to the boat which was carrying out the draft survey with Chief Officer had sent the injured AB to shore hospital accompanied by 2nd.Officer and another AB. At  1440 LT, the shore doctor pronounced the injured AB deceased from his injuries.","Bulk Carrier","Loss of life","32987","","56741","","","","","[Primary Annex 2 not designated]","[Primary Annex 2 not designated]","[Primary Annex 2 not designated]","[Primary Annex 2 not designated]","[Primary Annex 2 not designated]","[Primary Annex 2 not designated]","2023-06-23",""
"C0013536","1","ZILOS (IMO 9199206)","ZILOS: SOLAS","PAN","2021-09-01 17:00","Very serious"," ","South Atlantic Ocean, 800 miles of Uruguay","0","0","Fire or explosion","The ship sustained explosion in engine room, caught fire and lost power in the South Atlantic Ocean, 800 miles E of Punta Del Este, Uruguay at 1700 hours LT (UTC-3) on 1 Spetember 2021. 

A crew member died in the incident. The Uruguayan Navy salvage vessel ROU 'MALDONALDO' proceeded to the scene to assist. Owners hired AHTS 'BG WARRIOR' on 4 September 2021 to effected tow to an achorage off Montevideo, Uruguay arriving on 18 September 2021 for inspection. The ship was berthed alongside Montevideo on 23 September 2021 for repairs. ","Bulk Carrier","Loss of life","25543","Nippon Kaiji Kyokai (NKK)","46541","","","","","[Primary Annex 2 not designated]","[Primary Annex 2 not designated]","[Primary Annex 2 not designated]","[Primary Annex 2 not designated]","[Primary Annex 2 not designated]","[Primary Annex 2 not designated]","",""
"C0013609","1","TEAL BAY (IMO 9343637)","TEAL BAY: SOLAS","IMN","2021-08-30 22:35","Very serious","450796N 0363490E","Kavkaz","1","1","Damages to ship or equipment","At about 2235 on 30 August 2021, the chief officer (C/O) of the Isle of Man
registered general cargo vessel Teal Bay was fatally injured when he was struck
on the head by a tensioned mooring line that sprang out of an open roller fairlead.
Teal Bay was loading grain when moored alongside an anchored bulk carrier. The
mooring line was being used to pull Teal Bay forward and it sprang free when its
lead angle became too great for the open fairlead to restrain it.","Open Hatch Cargo Ship","Loss of life","20236","DNV AS (DNV)","32327","Grain","16","","","[Primary Annex 2 not designated]","[Primary Annex 2 not designated]","[Primary Annex 2 not designated]","[Primary Annex 2 not designated]","[Primary Annex 2 not designated]","[Primary Annex 2 not designated]","2022-08-12","2023-02-20"
"C0013573","1","Aries Sun (IMO 9321847)","Aries Sun: Unknown/unspecified","LBR","2021-08-29 11:20","Very serious"," ","Turkey","1","0","Occupational accident","On August 29, 2021 at about 1120 LT, the vessel at South of Bozcaada Anchorage, Turkey, Bearing and distance from Camlik Point 219 degrees and 1.86 Nautical Miles, Lat39 48.4 N Long 025 57.3 E, during the Demucking of cargo tanks in preparation for proceeding to drydock. The company Superintendent who had been overseeing the vessel for shipyard was inspecting the No.3 Pt COT tanks de-mucking had been found at the bottom of the tank by Cadet. The alarm was raised, the Chief Officer (C/O) and the Chief Engineer (C/E) entered the tank after verifying that the atmosphere in the space was tested and found safe to enter. They found the company Superintendent severe injury to his head, lying face down and without any sign of life.","Crude Oil Tanker","Loss of life","59158","","115567","","","","","[Primary Annex 2 not designated]","[Primary Annex 2 not designated]","[Primary Annex 2 not designated]","[Primary Annex 2 not designated]","[Primary Annex 2 not designated]","[Primary Annex 2 not designated]","2023-06-01",""
"C0013585","1","FOLY (-)","FOLY: Unknown/unspecified","FRA","2021-08-28 00:00","Very serious","430505N 0060960E","Coastal waters (within 12 miles)","2","0","Fire or explosion","After refuelling a recreational motorboat exploded and a major fire started. Of the three people on board a woman was severely burned, her husband and daughter were lightly burned, another person on the quay was shocked. Faced with the difficulty extinguishing the fire, the motorboat was towed outside the port and sunk.","Other Activities Ships","Serious injuries,Ship rendered unfit to proceed","","","","","","0","","0","0","0","0","1","0","2022-07-13",""
"C0013562","1","MARIA LEONTINA (IMO 8799827)","MARIA LEONTINA: Unknown/unspecified","PRT","2021-08-23 00:00","Very serious","374616N 0254883W","Coastal waters (within 12 miles)","3","0","Damages to ship or equipment","On 23-8-2021 whilst at sea returning from fishing one crew member was seen on the kitchen deck with spasms due to electrocution. SAR was requested and the crew provided life support. The injured crew member was taken to hospital where he passed away two days later.","Fish Catching Vessel","Loss of life,Ship remains fit to proceed","155","","","","8","0","0","1","0","0","0","0","0","2022-06-20",""
"C0013331","1","GLOBAL LAKE (IMO 9427469)","GLOBAL LAKE: SOLAS","LBR","2021-08-17 17:30","Very serious","352579N 0025340E","At Sea","1","0","Tank Cleaning incident","On August 25, 2021 at about 1730 LT, the vessel departed from Bejaia, Algeria to Cartagena / Spain to load the cargo, when the vessel position Lat 35-25.8 N Long 002-53.4 E, the Master, Bosun, and 2 Able Seafarers (ABs) were collapsed inside the cargo tank No.4 Stb and No. 4 Pt where the crews had been carrying out washing, mopping tank cleaning operation of previous cargo ““crude degummed soybean oil”. 
During the afternoon, the AB1 who was on duty at the main deck at the No.4 Pt tank manhole saw the Bosun and AB2 lying down at the bottom of the tank. The Master and Chief Officer (C/O) were notified immediately as they proceeded to the scene.  When they were at the scene, noted that the AB1 was also lying down at the bottom of the tank. The Master immediately entered the tank without PPE. The Master collapsed as soon as he reached the tank bottom. The rescue team had been activated immediately and lifted the victims from the tank. The Shore Medical advice and helicopter assistance were requested. The Helicopter rescue team arrived at the vessel and declared that the Master, Bosun, and AB2 were deceased. The AB1 was evacuated to the nearest shore hospital. 
","Chemical Tanker","Loss of life","5424","Bureau Veritas (BV)","7538","Oil","","","","[Primary Annex 2 not designated]","[Primary Annex 2 not designated]","[Primary Annex 2 not designated]","[Primary Annex 2 not designated]","[Primary Annex 2 not designated]","[Primary Annex 2 not designated]","2022-06-11",""
"C0013617","1","SEAWORKER (-)","SEAWORKER: Unknown/unspecified","SWE","2021-08-17 00:00","Very serious","560516N 0153526E","Archipelagos","2","0","Stranding / grounding","At noon on 17 August 2021, the work vessel SEAWORKER ran aground at Bredbden south of Karlskrona. Two people were on board, the master and a deckhand. They had been on their way from Utklippan back to Karlskrona. Automatic steering was used to keep the course. Some time into the trip, the master became very tired and felt that he needed to rest. He then left the conning of the ship to the deckhand, who, however, remained in the passenger seat. The deckhand lacked nautical competence, but had been on trips to Utklippan before. Just before Bredbden, the deckhand noticed that they were about to run aground. There was no time to make any corrective measures and the ship hit the ground at a speed of about 15 knots. The sea rescue operation was hampered by the fact that the area around the ship was shallow and no other ships could go near SEAWORKER. Both crew members were rescued by being lifted into a sea rescue helicopter, less than an hour after the grounding. The crew of SEAWORKER escaped with bruises and abrasions. The damage to the SEAWORKER, however, was extensive and the ship was later scrapped. At the time, there was a weak southwesterly wind and meter-high swells. The visibility was very good. The grounding was caused by a lack of attention to lookout and navigation. Due to fatigue, the master left the operation of the ship to the deckhand, who had no formal nautical training. He also did not have proper conditions to be able to perform the task as he remained in the passenger seat in the wheelhouse. An underlying reason may be that the master was ill the previous week and probably misjudged his general condition, this in turn may have influenced the decision to let the deckhand handle the ship from the passenger seat.","Other Activities Ships","","","","","","","0","","0","0","0","0","0","0","2022-08-18",""
"C0013571","1","KOI (IMO 9461489)","KOI: SOLAS","LBR","2021-08-16 15:05","Very serious"," ","Mediterranean Sea","1","0","Electric shock","On August 16, 2021 at about 1505 LT, while en route from Jeddah, Saudi Ariba to Tanger Med, Morocco loaded with General Cargo in Containers, at the Mediterranean Sea, position Lat 33-47 N Long 024-43 E, the Electrician (E/O) who was working at main cooling seawater pump No.2 motor located at engine room bottom platform had an electric shock when he was connecting winding heater cables. The Wiper 1 who was assigned to work together with E/O had noticed the situation had pulled the electric cables from E/O’s hand and tried to revive him. Wiper 1 ran and called for help to C/E and 2/E who were in Engine Room(E/R), they both went down, raised the alarm, and started given CPR.
The E/O was found unconscious with no external injury, CPR was given continuously. The Master contacted RCC Alexandria but not responded, contacted MEDICO ISRAEL by phone and informed the situation, the distance from the nearest land, and requested a medical evacuation. MEDICO ISRAEL relayed the message to RCC GREECE. 
The RCC GREECE responded to send their helicopter evacuation and instructed the vessel to the rendezvous point at KRITI ISLAND, GREECE. On August 16, 2048 LT, the rescue helicopter airlifted the injured E/O to shore hospital. Unfortunately, the E/O was declared Dead on Arrival by the hospital.
","Container Ship (Fully Cellular)","Loss of life","91585","","102518","","","","","[Primary Annex 2 not designated]","[Primary Annex 2 not designated]","[Primary Annex 2 not designated]","[Primary Annex 2 not designated]","[Primary Annex 2 not designated]","[Primary Annex 2 not designated]","2023-03-27",""
"C0013337","1","NIÑA AMYLU (-)","NIÑA AMYLU: Non-SOLAS","ECU","2021-08-12 20:00","Very serious","024900S 0801700W","Puna Island","1","0","Fire or explosion","On Thursday, August 12, 2021 at 8:00 p.m. approximately, the fishing boat ""NIÑA AMYLU"" was sailing high near the point of ""Subida Alta"", two of the people on board noticed smoke was coming out from engines room, when they entered the engine room there was fire, at that moment they gave the alert to the rest of the crew and proceeded to release other small boats tied up to the vessel stern, in matters of minutes the ship was filled with smoke and the crew trying to save itself from the flamesafter that the engine room make an explosion.
There were 19 crew members on the ship, two of them without authorization, of which 18 were rescued by another fishing boat named Merlina who gave alert the authorities. One crew member was found death 4 days later. ","","Loss of life,Total loss of the ship","131.96","[No class]","","fishing boat","19","","","[Primary Annex 2 not designated]","[Primary Annex 2 not designated]","[Primary Annex 2 not designated]","[Primary Annex 2 not designated]","[Primary Annex 2 not designated]","[Primary Annex 2 not designated]","2021-12-20",""
"C0013691","1","ARKLOW CLAN (IMO 9757113)","ARKLOW CLAN: Unknown/unspecified","IRL","2021-08-11 17:49","Serious","570857N 0020500W","Port","3","0","","The general cargo vessel Arklow Clan, berthed alongside at the Port of Aberdeen, Scotland, United Kingdom (UK) during the afternoon of 11 August 2021, in ballast condition, and scheduled to commence loading a cargo of scrap metal in bulk the following morning. At around 17.49 hours (hrs), three crewmembers commenced lowering the walkway handrails in preparation for loading operations. Whilst lowering the handrails, the Second Officer lost his footing, falling around 3.6 metres (m) from the walkway to the quay below. As a result of the impact the Second Officer sustained serious injuries to both his legs, necessitating an extensive period of hospitalisation, multiple surgeries, and rehabilitation.","General Cargo Ship","","2999","","5094","","","0","","0","0","0","0","0","0","2023-01-04",""
"C0013569","1","FORMOSABULK  CLEMENT (IMO 9222742)","FORMOSABULK  CLEMENT: SOLAS","LBR","2021-08-09 18:38","Very serious","264759S 1531468E"," Brisbane Outer Anchorage, Australia","1","0","MOB","On August 9, 2021, at about 1838 LT, the Chief Officer(C/O) who climbed down the Port side combination ladder to service boat had been pinched by the launch boat and fell into the sea at position Lat 26-47.6 S Long 153-14.7 E. The Man Over Board C/O was recovered by Launch boat and given CPR. The launch boat turned back ashore with C/O for about 40 minutes to a local hospital, Unfortunately, after 3 hours of emergency medical treatment, the C/O was pronounced deceased at 2130 LT on 9th.August 2021. The weather was recorded as Overcast Sky, Visibility- Good, Sea-Moderate, Swell- Rough with Fresh Breeze.","Bulk Carrier","Loss of life","","","","","","","","[Primary Annex 2 not designated]","[Primary Annex 2 not designated]","[Primary Annex 2 not designated]","[Primary Annex 2 not designated]","[Primary Annex 2 not designated]","[Primary Annex 2 not designated]","2022-08-22",""
"C0013693","1","Frazer Tintern (-)","Frazer Tintern: Unknown/unspecified","IRL","2021-08-05 18:05","Serious","521326N 0065759W","Inland waters","1","0","Fire or explosion","At approximately 18.05 hours (hrs) on 5 August 2021, when en route to Passage East, Co. Waterford the Master of the vessel Frazer Tintern detected a strong smell of diesel fuel. At that point, a crewmember called him to say that he could also get a strong smell of diesel and was going to investigate. When the crewmember got to the mesh door at the number one (No.1) engine compartment he was met with black smoke and flames. The crewmember notified the Master straight away that they had a fire onboard. The Master immediately shut down the No.1 engine and turned off the engine room fans. Two crewmembers then activated two portable fire extinguishers and rigged fire hoses to provide boundary cooling. The vessel continued to the Passage East slipway to get passengers off as quickly and safely as possible. As a precaution all passengers were summoned to the muster station and issued with lifejackets. On the way to the Passage East slipway the fire was brought under control. On arrival at Passage East all passengers and vehicles were disembarked in a safe manner. The vessel was then secured, and the remaining engines shut down. When the smoke dispersed fully the crew investigated the engine room to confirm the fire had been extinguished.","Passenger / Ro-Ro Cargo Ship","","","","","","","0","","0","0","0","0","0","0","2023-01-04",""
