Reference,NumberOfShipsInvolved,ShipsInvolved,SOLASStatus,FlagStates,IncidentDateTime,TypeOfCasualty,Coordinates,Location,NumberOfInvestigationReports,NumberOfAnalyses,InitialEvent,SummaryOfEvents,ShipType1,Consequences1,GrossTonnage1,ClassificationSociety1,Deadweight1,Cargo1,CrewOnboard1,PassengersOnboard1,OthersOnboard1,DeadMissingCrew2,DeadMissingPassengers2,DeadMissingOthers3,SeriouslyInjuredCrew2,SeriouslyInjuredPassengers2,SeriouslyInjuredOthers2,InvestationReportDate,AnalysisDate
"C0013697","1","VOLGO-BALT 179 (IMO 8231019)","VOLGO-BALT 179: SOLAS","COM","2021-03-11 04:40","Very serious","442000N 0302000E","Romania","0","0","Sinking","The ship sank in the black sea 80 miles NE of Constanta, Romania, in LAT. 44 20' 00"" N, long. 030 20' 00"" E at 0440 hours LT (utc+2) on 11 March 2021 in heavy weather.
10 of the 13 crew were rescued by nearby MV 'GSP FALCON'. 1 of the rescued crew sustained injuries. The body of a dead crew member was recovered, and another body was observed floating in the sea. The 13th crew member went missing. SAR operations effected.","General Cargo Ship","Loss of life,Serious injuries,Total loss of the ship","2457","","3506","","","","","[Primary Annex 2 not designated]","[Primary Annex 2 not designated]","[Primary Annex 2 not designated]","[Primary Annex 2 not designated]","[Primary Annex 2 not designated]","[Primary Annex 2 not designated]","",""
"C0013698","1","DANA TRADER (IMO 7726952)","DANA TRADER: SOLAS","TGO","2021-03-11 00:00","Very serious","313700N 0303600E","Egypt","0","0","Sinking","The ship sank whilst underway in the Mediterranean Sea 38 miles NW of Abu Qir, Egypt, in LAT. 31 37' 00""n, Long. 030 36' 00""e early am on 11 March 2021
MVS 'Stolt Sycamore’,' Berlin Bridge', and nearby fishing vessels assisted with SAR operations. 9 crew members were rescued, one was dead, and one was missing. Investigation effected.","General Cargo Ship","Loss of life,Total loss of the ship","1892","","2360","","","","","[Primary Annex 2 not designated]","[Primary Annex 2 not designated]","[Primary Annex 2 not designated]","[Primary Annex 2 not designated]","[Primary Annex 2 not designated]","[Primary Annex 2 not designated]","",""
"C0013224","2","OLYMPIA (IMO 9765574), TB 96666 TS (-)","OLYMPIA: SOLAS, TB 96666 TS: Non-SOLAS","MHL,VNM","2021-03-09 09:15","Very serious","130839N 1104860E","South China Sea","1","1","Collision","The Marshall Islands-registered OLYMPIA and the Vietnam-registered TB 96666 TS (fishing vessel) collided approximately 80 NM offshore Vietnam. TB 96666 TS sank following the collision. Two of the fishing vessel's crewmembers are missing. The other seven were rescued by OLYMPIA.","Container Ship (Fully Cellular)","Loss of life,Ship remains fit to proceed","17907","DNV GL AS","22000","Containerized general cargo","","","","[Primary Annex 2 not designated]","[Primary Annex 2 not designated]","[Primary Annex 2 not designated]","[Primary Annex 2 not designated]","[Primary Annex 2 not designated]","[Primary Annex 2 not designated]","2022-08-24","2023-02-23"
"C0013610","2","ATLE (-), FINLANDIA SEAWAYS (IMO 9198721)","ATLE: Unknown/unspecified, FINLANDIA SEAWAYS: Unknown/unspecified","DNK,SWE","2021-03-08 00:00","Serious","560916N 0144946E","Port","2","0","Collision","On Monday 8 March 2021, the dredging barge LENNART, together with the tug ATLE, was dredging within a restricted area of Stilleryd Harbour outside Karlshamn. That same morning, the ro-ro vessel FINLANDIA SEAWAYS arrived at the harbour. Due to a forthcoming practical exam for fairway-specific pilot exemption certificate, the master manoeuvred the vessel in the fairway towards the dock while the pilot, who had come on board outside of the harbour, took on a supervisory role. Just after the vessel had passed the dredging unit, a turn to port was initiated with the intention of turning the vessel around and then reversing it into its berth further into the harbour. Once the turn had begun, the vessel moved astern and thus got closer to the dredging unit. When the people on the vessels bridge acknowledged the vessels direction of travel and the decreasing distance to the dredging unit, the engine controls were set to full ahead. Just after this, the stern of the vessel collided with the tug ATLE. The collision resulted in extensive damage to ATLE. The occurrence did not result in any personal injuries. The occurrence was caused by inadequate situational awareness among the crew and pilot on board FINLANDIA SEAWAYS. The inadequate situational awareness may be explained to some extent by the manoeuvring controls on the bridge being switched over from the centre console to the bridge wing after the turn to rotate the vessel around had been initiated. In conjunction with the switch-over, the sense of the vessels speed and direction of travel was momentarily lost. The control function, in the form of a lookout in the stern, was activated too late to prevent the collision. Another probable contributing factor is that the master was distracted due to the forthcoming exam and thus lost focus on the vessels movements when she was being turned around.","Ro-Ro Cargo Ship","","11530","","8702","","","0","","0","0","0","0","0","0","2022-08-15",""
"C0013488","1","BARRAMUNDI (IMO 9813113)","BARRAMUNDI: SOLAS","MHL","2021-03-07 11:30","Very serious","222629N 1190089E","South China Sea","1","0","Occupational fatality","The Bosun on board BARRAMUNDI died after removing fumigant from a cargo hold. The Bosun and the ASD with whom he was working were both wearing appropriate PPE (disposable/non-permeable coveralls and masks with filters). ","Bulk Dry / Oil Carrier","Loss of life,Ship remains fit to proceed","54043","DNV GL AS","82447","","20","","","[Primary Annex 2 not designated]","[Primary Annex 2 not designated]","[Primary Annex 2 not designated]","[Primary Annex 2 not designated]","[Primary Annex 2 not designated]","[Primary Annex 2 not designated]","2023-07-24",""
"C0013484","1","CAPTAIN V. MADIAS (IMO 9617351)","CAPTAIN V. MADIAS: Unknown/unspecified","MLT","2021-03-02 00:00","Less serious","011270S 1274921E","Archipelagos","2","0","Stranding / grounding","At 1155, on 02 March 2021, the Maltese registered bulk carrier Captain V. Madias ran aground on a shoal off Pulau Bisa in the Indonesian Archipelago, while on passage from Batangas, Philippines to Queensland, Australia. The vessels primary means of navigation was ECDIS. The officer of the watch was following a route displayed on the ECDIS, when unexpected shuddering was felt. Soon after, the vessel came to an abrupt stop. The safety investigation determined that the immediate cause of the grounding was the proximity of the vessels track to the shoal.","Bulk Dry (general, ore) Carrier","Ship remains fit to proceed","43472","Bureau Veritas (BV)","79501","","23","0","0","0","0","0","0","0","0","2022-03-02",""
"C0013553","1","VESTA (-)","VESTA: Unknown/unspecified","SWE","2021-03-01 00:00","Very serious","574146N 0114778E","Port","2","0","","On Monday the 1 March 2021, three persons worked with diving inspections of the quay facility in Torshamnen in Gothenburg. They worked from the ship VESTA, an eleven-metre-long workboat. At half past nine in the morning, the crew stopped the work to take a lunch break. They intended to moor at the bridge that runs between Torshamnen and Risholmen, a low bridge that has a vertical clearance of about three meters. The boat was slowly manoeuvring towards the bridge and one of the crew members went forward to be ready to moor. The driver engaged reverse gear, but there was no effect, after which he pulled the control further back. VESTA then continued forward in a rapid starboard turn and hit the bridge. The person in the bow did not manage to dodge or get himself to a safe position and got caught between the wheelhouse and the bridge suffering severe fatal injuries. The rescue effort was hampered by the difference in height between the bridge and the boat, but another of the company's boats arrived quickly to the scene of the accident and towed VESTA to the southern end of the bridge where an ambulance could take care of the injured for further transport. The accident was caused by a fatigue induced crack leading to a failure in the stainless-steel wire in the control cable, used for switching between ahead and astern. Ahead remained in place, despite the control lever being pulled towards astern. The control lever then worked in an opposite way in the reverse position and full astern then became full ahead. The short distance to the bridge meant that the driver of the boat did not have time to take any corrective measures before the collision. A prerequisite for the fracture of the metal wire was that the control cable was bent where the flexible casing meets the rigid metal end sleeve, which eventually led to a fatigue fracture due to repeated bending and straightening movements at each shifting. The underlying causes are a lack of ability to inspect the internal condition of the control cable and a lack of specified replacement intervals. It had thus not been possible to determine the condition of the metal wire with less than with destructive testing.","Other Activities Ships","Loss of life,Ship rendered unfit to proceed","","","","","3","0","","1","0","0","0","0","0","2022-05-24",""
"C0013180","1","YM INCREMENT (IMO 9319143)","YM INCREMENT: SOLAS","LBR","2021-02-28 15:31","Very serious","024110N 1012320E","Out side Port Klang, Malaysia","0","0","Accidents with life-saving appliances","On February 28, 2021 about 1531 LT, while the vessel anchored outside Port Klang, Malaysia, position Lat 02-41.1 N Long 101-23.2 E, the vessel carried out lifeboat drill of Starboard side No.1 Lifeboat, the Bosun had a severe head injury from Lifeboat Davit manual tool. The Master requested the Port Klang local agent for urgent medical assistance was not granted due to COVID 19 restrictions. According to the Local agent, the patient needs to wait more than 8 hours to get approval to send ashore. At 1736 LT the Master heaved up the anchor and proceeded to Singapore. The Master requested to Malaysia MRCC for airlifted was also denied due to COVID 19. 
On March 01,2021 at 0052 LT, the Master contacted to Singapore local agent. The vessel anchored at 0724 LT and the injured Bosun was taken to ashore by boat at 0756 LT to the hospital. Unfortunately, the local agent informed that the injured Bosun passed away at 1215 LT. 
","Container Ship (Fully Cellular)","Loss of life","16488","DNV GL AS","22027","","","","","[Primary Annex 2 not designated]","[Primary Annex 2 not designated]","[Primary Annex 2 not designated]","[Primary Annex 2 not designated]","[Primary Annex 2 not designated]","[Primary Annex 2 not designated]","",""
"C0013626","1","CREST RADIANT 1 (IMO 9499979)","CREST RADIANT 1: SOLAS","SGP","2021-02-26 01:30","Very serious","250980N 0541610E","OFF ABU NUAYR ISLAND","1","0","Missing: assumed lost","
1.	On February 25th ,2021 Crest Radiant 1 arrived in shelter area at 2330 
2.	2nd. Officer was on steering and Master was in his cabin
3.	AB Abhiraj went to main deck to clear the mooring rope as it was moving toward propeller  
4.	Off duty Chief Officer Paulus Laying went to toward main deck to help the AB
5.	A big swell coming from starboard side hit the Chief Officer and he lost his balance and fell overboard.
6.	AB Abhiraj informed 2nd officer and throw 3 lifebuoys towards chief officer
7.	2nd officer raise the alarm and informed the captain and switched on the search lights
8.	All the crew tried to search the chief officer
9.	Master tried maneuvering Williamson turn for search
10.	On Feb 26 0322 LT master informed  company alternate DPA and call all the vessels working nearby 
11.	At 0330 vessel called 999 and after some time coast guard call the vessel
12.	Coast guard arrived at 0756 LT on location. Search and rescue operation started with helicopter 
13.	Other nearby vessels also helped in search 
14.	At 1210 LT BGP COMMANDER called on VHF and informed that they have found the body. Crest Radiant 1 informed all the search parties about this news and conducted a meeting for further planning.
15.	At 1445 Crest Radiant 1 reached at the body location. Coast Guards advised vessel not to pick up the body until their arrival.
16.	Coast Guards arrived the location and observed the location and authorized Crest Radiant 1 to pick up the body.
17.	Recovery operation was slow and difficult because of swell and vessel was unable to maintain a steady position.
18.	At 1555 LT Crest Radiant 1 recovered the body and informed all the parties involved in rescue operation.
19.	At 1630 LT vessel proceed to Freeport and 0310 LT reached Freeport berth no.25.
20.	Vessel was in contact with all the local authorities.
21.	At 0425 LT police and an ambulance received the body of Chief officer from Crest Radiant 1.","Offshore Tug/Supply Ship","","764","Bureau Veritas (BV)","1000","No cargo","12","0","2","[Primary Annex 2 not designated]","[Primary Annex 2 not designated]","[Primary Annex 2 not designated]","[Primary Annex 2 not designated]","[Primary Annex 2 not designated]","[Primary Annex 2 not designated]","2022-11-06",""
"C0013518","1","CSSC CAPE TOWN (IMO 9853888)","CSSC CAPE TOWN: SOLAS","HKG","2021-02-19 21:10","Unspecified"," ","Gibraltar","1","0","","Explosion incident","Bulk Dry (general, ore) Carrier","","66786","","120578","","","","","[Primary Annex 2 not designated]","[Primary Annex 2 not designated]","[Primary Annex 2 not designated]","[Primary Annex 2 not designated]","[Primary Annex 2 not designated]","[Primary Annex 2 not designated]","2022-04-26",""
"C0013682","1","APRIL (IMO 9013024)","APRIL: SOLAS","PAN","2021-02-19 00:00","Very serious","453025N 0363500E","The Sea of Azov 12 Miles NW of Kavkaz, The Russian Federation","0","0","Damages to ship or equipment","The ship sustained a crack on the side ballast tank and a hole in the bottom ballast tank, took water and developed a list to starboard whilst anchored in the sea of Azov 12 miles NW of Kavkaz, The Russia Federation in latitude 45 30' 25"" N, long. 036 35' 00"" E.
7 crew were poisoned, and 1 crew member died after exposure to toxic gas released after the cargo reacted with inflowing water. The local authority attended the scene and medical evaluation to all the crew for medical attention.
Taken in tow by tug 'mercury' to safe water nearby. The salvage team boarded the vessel with a protective suit and pumped the water out to stabilize the vessel. The diver patched the crack and hole. Permanent repairs are to be effected.
","General Cargo Ship","Loss of life","1247","","1820","","","","","[Primary Annex 2 not designated]","[Primary Annex 2 not designated]","[Primary Annex 2 not designated]","[Primary Annex 2 not designated]","[Primary Annex 2 not designated]","[Primary Annex 2 not designated]","",""
"C0013247","1","UK DIVERSITY (IMO 7359125)","UK DIVERSITY: SOLAS","PLW","2021-02-18 06:15","Very serious"," ","out of Benghazi port","0","0","Machinery damage","Main Enginne stopped due to broken coupling, heavey swell, broken air vent, water going inside DB Tanks.  Ship started listing and cargo bag shifted from port side to stbd side and water started going inside cargo hold.
At 0400 hrs Libya coast guard was contacted out of Bengazi port, but got not reply.
at 0700 hrs switch on distress message. Replied received from Ship Zari
at 0715 hrs dropped two life rafts
at 0730 hrs allowed abandon ship. All the crew jumpled to the life raft, 09 person boarded and 2 person floating into the sea.

After we see two big ship come to rescue us which was contacted by hand VHF (GMDSS)
1040 hrs rescued 09 person from ship CHARLY from life raft
1130 hrs ship ZARIFA rescue last 02 persons from the sea.
","General Cargo Ship","Total loss of the ship","1920","International Register of Shipping (IS)","2753","","11","","","[Primary Annex 2 not designated]","[Primary Annex 2 not designated]","[Primary Annex 2 not designated]","[Primary Annex 2 not designated]","[Primary Annex 2 not designated]","[Primary Annex 2 not designated]","",""
"C0013185","1","COPIOUS (IMO 9395757)","COPIOUS: SOLAS","GBR","2021-02-18 03:19","Very serious","593770N 0003430W","Lerwick","0","0","Man Overboard","Crew member of a fishing vessel fell overboard while reach for the fish gear. He was wearing a lifejacket but it did not keep the crewman's head above the water. The FV was unable to manoeuvre to recovery the crewman but after raising the alarm he was recovered, unconscious, by helicopter and flown to hospital where he was pronounced deceased.","Fishing Vessel","Loss of life","145","","70","","5","0","0","[Primary Annex 2 not designated]","[Primary Annex 2 not designated]","[Primary Annex 2 not designated]","[Primary Annex 2 not designated]","[Primary Annex 2 not designated]","[Primary Annex 2 not designated]","",""
"C0013257","1","MARGRETHE FIGHTER (IMO 8705620)","MARGRETHE FIGHTER: Unknown/unspecified","DNK","2021-02-17 00:00","Very serious","552191N 0130911E","Port","2","0","Capsizing / listing","The vessel capsized, fully loaded with mud from the seabed, during a sharp turn i the port of Trelleborg in Sweden. Two persons saved by SAR one person (the Master) did not get out of the whel house and drowned.","Dredger","Loss of life,Serious injuries,Ship rendered unfit to proceed,Total loss of the ship","270","[Other]","425","","3","0","","1","0","0","2","0","0","2021-06-24",""
"C0013577","1","VENUS (IMO 9661455)","VENUS: Non-SOLAS","SGP","2021-02-16 22:46","Very serious","011670N 1035559E","The Port of Singapore","1","0","Man Overboard","On 16 February 2021, at about 2246H, the Singapore registered bunker tanker, Venus was alongside the Saudi Arabia registered chemical tanker NCC Amal (Amal) anchored at the Eastern Special Purpose Alpha anchorage in the Port of Singapore.

A shore technician (ST), after completing servicing of the oily water separator onboard Amal, instead of utilising the combination ladder to disembark, crossed over to Venus for disembarking to a supply boat. While descending from the pilot ladder of Venus, the ST fell into the water. Efforts to bring the ST out of the water by a bunker surveyor and the skipper of the supply boat were to no avail. The ST was eventually brought out 
of the water by the port authority patrol boat which responded to the man overboard call. The ST was unconscious when rescued from the water and subsequently passed away in hospital.","Products Tanker","Loss of life","4374","China Classification Society (CCS)","6985","Product oil","10","0","0","[Primary Annex 2 not designated]","[Primary Annex 2 not designated]","[Primary Annex 2 not designated]","[Primary Annex 2 not designated]","[Primary Annex 2 not designated]","[Primary Annex 2 not designated]","2022-07-01",""
"C0013412","1","Anna Mamm Mari (-)","Anna Mamm Mari: Unknown/unspecified","FRA","2021-02-15 00:00","Serious","460720N 0020500W","Open sea","2","0","","The F/V ANNA MAMM MARI was on it's fishing area when a deckhand fell overboard with his leg trapped by the net. He was quickly hoisted on board and the crew managed to resuscitate him. He was evacuated by an helicopter.","Fish Catching Vessel","Serious injuries","","","","","6","0","","0","0","0","1","0","0","2022-01-27",""
"C0013183","1","GREATSHIP ROHINI (IMO 9522532)","GREATSHIP ROHINI: SOLAS","IND","2021-02-13 09:15","Very serious","193300N 0712100E","Arabian Sea, 100 miles NW of Mumbai, India","0","0","Fire or explosion","The ship caught fire in the engine room near the NQO platform in the Arabian Sea, 100 miles NW of Mumbai, India, at LAT. 19 33'30"" N, LONG. 071 21'20"" E at 0915 hours LT (UTC+5) on 13 February 2021 in good weather. The blaze was controlled with assistance from nearby vessels and the Indian Coast Guard patrol vessel ICGS ""SAMUDRA PRAHARI"" 7 hours later. 1 crew member sustained burn injuries and was airlifted ashore to the hospital by helicopter. 3 crew members were missing; their bodies were recovered from the interior the following day. The ship sustained severe damage to the engine room. The ship was towed by ORSV ""GREAT SHIP ANJALI"" and arrived at Mumba on 15 February 2021 for inspection and investigation. ","Platform Supply Ship","Loss of life","3147","Indian Register of Shipping (IRS)","3656","","","","","[Primary Annex 2 not designated]","[Primary Annex 2 not designated]","[Primary Annex 2 not designated]","[Primary Annex 2 not designated]","[Primary Annex 2 not designated]","[Primary Annex 2 not designated]","",""
"C0013228","1","DERBY (IMO 9464780)","DERBY: SOLAS","MHL","2021-02-13 09:10","Very serious","005190S 0760250E","Indian Ocean","1","0","Fall from Height","Bosun fell into cargo hold while attempting to lower a drum of tools using a winch.","Bulk Carrier","Loss of life","43846","","80333","","19","","","[Primary Annex 2 not designated]","[Primary Annex 2 not designated]","[Primary Annex 2 not designated]","[Primary Annex 2 not designated]","[Primary Annex 2 not designated]","[Primary Annex 2 not designated]","2022-04-20",""
"C0013158","1","PRINCE 4 (IMO 8512865)","PRINCE 4: SOLAS","COM","2021-02-12 17:55","Serious","463459N 0312160E","Black sea, 1,5 nm from the entrance of Buzko-Dniprovsko-Lymanskyi Channel","0","0","Fire or explosion","12.02.2021 at 17:55 LT (UTC+3)  on board the ship ""PRINCE 4"" (IMO 8512865, flag Comoros islands ), which was under pilotage with a cargo of wheat of 11,500 tons in bulk, after the vessel left the Buzko-Dniprovsko-Lymanskyi Channel (BDLK) in position: latitude-46034.6N; longitude-031021.6E, a fire started in the main deck accommodation cabin and spreaded over in to the superstructure.","Bulk Carrier","Ship rendered unfit to proceed","7110","","12367","wheat of 11,500 tons in bulk","18","","1","[Primary Annex 2 not designated]","[Primary Annex 2 not designated]","[Primary Annex 2 not designated]","[Primary Annex 2 not designated]","[Primary Annex 2 not designated]","[Primary Annex 2 not designated]","",""
"C0013848","2","CALYPSO. GR (IMO 9785134), SOETKIN (IMO 9222065)","CALYPSO. GR: Unknown/unspecified, SOETKIN: Unknown/unspecified","BEL,MHL","2021-02-12 03:52","Serious","502744N 0002971W","Open sea","1","0","Collision","On February, 12th, 2021 at 0352 AM, Belgian fv Z.18 SOETKIN collided with the Marshall Islands' general cargo vessel CALYPSO GR in the English Channel between Traffic separation Scheme Dover and TSS English Channel. Fv Z.18 SOETKIN was fishing, mv CALYPSO GR was loaded with a cargo of ammonium nitrate and on her way from Latvia to Panama canal. Fv Z.18 SOETKIN lost her trawl gear on both sides. The bow was structurally damaged above the waterline, in front of the collision bulkhead.","Fish Catching Vessel","Ship remains fit to proceed","386","","","","","0","","0","0","0","0","0","0","2023-08-01",""
"C0013333","1","GALLIPOLI SEAWAYS (IMO 9215476)","GALLIPOLI SEAWAYS: SOLAS","TUR","2021-02-11 13:11","Serious","394350N 0254670E","Southwest of Bozcaada-Çanakkale/Turkey","1","0","Fire or explosion","GALLIPOLI SEAWAYS Ro-Ro ship was loaded with semi hybrid buses from Istanbul Pendik Ro-Ro port and left the port on 11th of February 2021 at 02:18 LT (GMT +3) and while en route to Italy / Trieste, a fire broke out inside closed vehicle deck at around 13:11 LT after Çanakkale Strait passage at southwest of Bozcaada. Although the sprinkler system was activated, the ship could not extinguish the fire with its' own means due to heavy smoke and power of fire and assistance was requested from Kumkale Vessel Traffic Services (VTS). 

GALLIPOLI SEAWAYS listed six degrees to starboard side due to water from sprinkler system and with the effect of heavy weather and wind from the side. The ship was towed to Çanakkale Akçansa port. Passengers were disembarked at around 21:00 LT on 11th of February 2021. Fire extinguishing operations were carried out with tugs and fire brigades. At the end, the fire was taken under control and completely extinguished on 12th of February 2021 at around 11:00 LT. Cooling operations were carried out for a while and the list of the ship was corrected by discharging the water inside. ","Ro-Ro Cargo Ship","Ship rendered unfit to proceed","26525","Lloyd's Register (LR)","9865","","22","","","[Primary Annex 2 not designated]","[Primary Annex 2 not designated]","[Primary Annex 2 not designated]","[Primary Annex 2 not designated]","[Primary Annex 2 not designated]","[Primary Annex 2 not designated]","2023-02-22",""
