Reference,NumberOfShipsInvolved,ShipsInvolved,SOLASStatus,FlagStates,IncidentDateTime,TypeOfCasualty,Coordinates,Location,NumberOfInvestigationReports,NumberOfAnalyses,InitialEvent,SummaryOfEvents,ShipType1,Consequences1,GrossTonnage1,ClassificationSociety1,Deadweight1,Cargo1,CrewOnboard1,PassengersOnboard1,OthersOnboard1,DeadMissingCrew2,DeadMissingPassengers2,DeadMissingOthers3,SeriouslyInjuredCrew2,SeriouslyInjuredPassengers2,SeriouslyInjuredOthers2,InvestationReportDate,AnalysisDate
"C0013781","1","HYUNDAI TECHNOPIA (IMO 9155145)","HYUNDAI TECHNOPIA: SOLAS","KOR","2021-06-16 16:52","Very serious","350250N 1283979E","the waters adjacent to Geojedo Island","1","0","Fatality","The LNG Tanker, HYUNDAI TECHNOPIA, departed from shipyard at 15:06 on 16th June 2021. At 16:52 on the same day when the AB, OS(A) and OS(B) were facing one another and lifting the toolbox on the electric cable way atop cargo tanks, OS(B) lost his balance and fell towards the chain railings, plunging about 18 meters onto the upper deck. OS(B) had serious injury and eventually died after moved to a hospital.","LNG Tanker","Loss of life","113998","","77584","LNG","","","","[Primary Annex 2 not designated]","[Primary Annex 2 not designated]","[Primary Annex 2 not designated]","[Primary Annex 2 not designated]","[Primary Annex 2 not designated]","[Primary Annex 2 not designated]","2023-03-23",""
"C0013598","1","CEYLON PRINCESS (IMO 9734575)","CEYLON PRINCESS: SOLAS","LKA","2021-06-16 11:46","Very serious","130759S 0952720E","177 miles off Cocos Island","0","0","Accidents with life-saving appliances","Able seaman Mohamed Shaffie (CDC C032260) was under medication for Gastritis since 19 April 2021. Around 2345 hrs. lt on 13th June 2021 reported severe pain in upper abdomen, vomiting and unable to sleeping after dinner. The 2nd Officer treated him with the help of radio medical advice and given him a bed rest. 0754 hrs. On 16th morning severe pain all over the body and suddenly became unconscious around 0815 hrs. Cleared the mouth and airway, pulse, heartbeat, temperature, continued WITH CPR. Vessel was around 177 miles off coast of Cocos Island and reported to all respective authorities including MRCC Australia. Contacted doctor from MRCC over the satellite phone and update the condition. Vessel divert to Cocos island as per DPA advice and on the way to the nearest land of Cocos island, the doctor from MRCC examined him and confirm the patient is deceased.  ","Bulk Dry (general, ore) Carrier","Loss of life","36432","DNV GL AS","63213","","35","","","[Primary Annex 2 not designated]","[Primary Annex 2 not designated]","[Primary Annex 2 not designated]","[Primary Annex 2 not designated]","[Primary Annex 2 not designated]","[Primary Annex 2 not designated]","",""
"C0013705","1","DEVON (IMO 9406843)","DEVON: SOLAS","XKA","2021-06-16 05:30","Very serious","101944N 0833534E","India","0","0","Damages to ship or equipment","The ship sustained cracks in a port fuel tank at frame no. 49 below the waterline whilst underway in the Bay of Bengal 294 miles SE of Chennai, India in LAT. 10 19' 44"" N, LONG. 083 35' 35"" E at 1338 hours LT (UTC+5:30) on 16 June 2021.
Indian coast guard aircraft attended the scene. 10,000 litres of heavy fuel oil leaked into the water. They continued on the voyage to Haldia, India, for inspection and repairs.
","Container Ship (Fully Cellular)","Pollution","9957","","13747","","","","","[Primary Annex 2 not designated]","[Primary Annex 2 not designated]","[Primary Annex 2 not designated]","[Primary Annex 2 not designated]","[Primary Annex 2 not designated]","[Primary Annex 2 not designated]","",""
"C0013669","1","AROYAT (IMO 9151395)","AROYAT: SOLAS","PLW","2021-06-11 08:00","Unspecified","310100S 0503000W","AT SEA","1","0","Missing: assumed lost","Crew member jump overboard while the vessel was at sea. ","Bulk Carrier","Loss of life,Ship remains fit to proceed","11194","Phoenix Register of Shipping S.A. (PHRS)","18315","","22","","","[Primary Annex 2 not designated]","[Primary Annex 2 not designated]","[Primary Annex 2 not designated]","[Primary Annex 2 not designated]","[Primary Annex 2 not designated]","[Primary Annex 2 not designated]","2022-11-03",""
"C0013578","1","EPIC BORACAY (IMO 9521588)","EPIC BORACAY: SOLAS","SGP","2021-06-10 09:35","Very serious","071130S 0343220W","South Atlantic Ocean, about 14NM off Brazil","1","1","Man Overboard while performing deck work sitting on a 'A' frame portable ladder","On 10 June 2021, the SRS gas carrier, MT Epic Boracay, was transiting in the South Atlantic Ocean, bound for a Brazilian port. At about 0800H (local time), after handing over the navigational watch to the Third Officer, the Chief Officer tasked two able-seafarer deck (ASD) to carry out painting work for the undersides of two separate stairway landings from the boat-deck.

After the ASDs collected the required tools, they began the painting work using telescopic rods connected to roller-brushes. About an hour into the painting work, one of the ASDs (ASD-1) saw the other ASD (ASD-3) carrying a portable A-frame ladder to the boat-deck. Shortly after, the ASD-3 was seen sitting on top of the ladder carrying out the painting and then losing his balance when the ladder tilted, while EB was altering course. The ASD-3 and the ladder fell overboard. 

A man-overboard procedure was carried out and with the assistance of a nearby fishing vessel, the motionless body of ASD-3 was recovered on board. Attempts to resuscitate the ASD-3 were unsuccessful.","LPG Tanker","Loss of life","5836","American Bureau of Shipping (ABS)","6519","","17","","","[Primary Annex 2 not designated]","[Primary Annex 2 not designated]","[Primary Annex 2 not designated]","[Primary Annex 2 not designated]","[Primary Annex 2 not designated]","[Primary Annex 2 not designated]","2022-07-01","2023-02-20"
"C0013737","1","Lokarda (-)","Lokarda: Unknown/unspecified","HRV","2021-06-05 12:54","Very serious","432409N 0153810E","Coastal waters (within 12 miles)","1","0","Fire or explosion","On the early afternoon of 5 June 2021, fire caught the engine room of the fishing vessel Lokarda while she was trawling within the territorial waters of Republic of Croatia (about 15,4 NM south of the island of irje). Crew members immediately noticed the fire and started extinguishing it. They used all available firefighting equipment and still weren't able to extinguish the fire, so the fire spread to other parts of the vessel and forced crew members to abandon the vessel. Vessels of the marine police, Harbormasters offices Split and ibenik and other nearby vessels were sent to the site. Crew members were rescued by the fishing vessel Strelica, which first arrived. Crew members then embarked the boat of the Harbormasters office Split - Branch in Milna and sailed towards the Port of Trogir for medical examination. Other vessels at the site could not extinguish the fire so the firefighting vessels were sent towards the fishing vessel Lokarda. One firefighting vessel arrived at the site and started extinguishing the fire, however fishing vessel Lokarda foundered at 21:05 local time (UTC + 2) to a depth of about 180 meters.","Fish Catching Vessel","Ship rendered unfit to proceed,Total loss of the ship","88","Croatian Register of Shipping (CRS)","","","3","0","0","0","0","0","0","0","0","2023-01-25",""
"C0013670","1","STAR PLANET (IMO 9316036)","STAR PLANET: SOLAS","BHS","2021-06-04 13:50","Very serious","353470S 1283990E","Australian Bight","1","0","Crew Fatality","- The Master completed the toolbox meeting with the C/O at 09:50lt. The C/O at 13:45 descended in cargo hold no.7 by using the Australian ladder.
- After a while 13:50, the AB was looking for C/O and observed that entrance covers of cargo hold no.7 was open and went down from the Australian ladder to check if C/O needs any assistance and he saw him next to the vertical ladder laying on the tank top and moaning, with his head bleeding all crew alerted and proceeded to Cargo Hold no.7 following the Company's procedures for serious injury/accident. They provided first aid, medical oxygen, blankets etc. It was observed that the C/O was heavily injured at back side of his head. The breathing signs were reducing and after several trials and continuous oxygen and breathing assistance it was verified that the heart stopped with no sign of breathing and no activity on eyes. After taking permission from AMSA doctor the crew recovered the body on deck and transferred to the hospital","Bulk Carrier","","40042","","76812","","","","","[Primary Annex 2 not designated]","[Primary Annex 2 not designated]","[Primary Annex 2 not designated]","[Primary Annex 2 not designated]","[Primary Annex 2 not designated]","[Primary Annex 2 not designated]","2022-11-07",""
"C0013864","1","CENTRAL PARK (IMO 9725823)","CENTRAL PARK: Unknown/unspecified","LBR","2021-06-03 09:10","Less serious","511547N 0042129E","Port","1","0","","On June 3rd 2021, Mv CENTRAL PARK loaded a cargo of sulphuric acid at the port of Antwerp. Around 0920, an AB accompanied the BV surveyor towards the manifold on board to take samples of a filled cargotank. Meanwhile, the filling of another cargotank had just finished. During purging of the charging line, a leakage occured at a packing seal at 10m distance from the AB and a mist of sulphuric acid was blown towards the AB. The AB was not wearing any specific PPE, as he was not taking any samples and he was keping sufficient distance from the manifold where the surveyor was busy. The AB got chemical burns over his face and body and was transported to a hospital nearby.","Chemical Tanker","Serious injuries","12145","","19998","","","0","","0","0","0","1","0","0","2023-08-01",""
"C0013645","1","Affluent Ocean (IMO 9162320)","Affluent Ocean: SOLAS","PAN","2021-06-02 16:20","Serious","221870N 1140740E","Hong Kong, Kellett Achorage No. 3","1","0","Fire or explosion","At 1620 hours on 2 June 2021, a fire broke out on board Panama registered general cargo vessel “Affluent Ocean” (the vessel) causing its structural damage while the vessel was anchoring at Kellett Anchorage No.3, Hong Kong, for loading scrap metal in bulk. The fire was extinguished at about 0820 hours on 3 June 2021. Fortunately, there were no casualties and oil pollution.","General Cargo Ship","Ship remains fit to proceed","6448","Panama Maritime Documentation Services (PMDS)","8747","","","","","[Primary Annex 2 not designated]","[Primary Annex 2 not designated]","[Primary Annex 2 not designated]","[Primary Annex 2 not designated]","[Primary Annex 2 not designated]","[Primary Annex 2 not designated]","2022-10-06",""
"C0013704","1","INSPECTA 7 (IMO 9198343)","INSPECTA 7: SOLAS","EGY","2021-06-01 00:00","Very serious","281900N 0330755E","Egypt","0","0","Sinking","The ship struck a submerged wreck, took water and subsequently sank in the Gulf of Suez 4 miles SE of Ras Ghareb, Egypt, in LAT. 28 19' 00"" N, LONG. 033 07' 55"" E late pm on 1 June 2021.
It sustained a hole in the hull's starboard side, and the ship sank within 10 minutes. 4 tugs were dispatched to the scene, and 11 crew were rescued. The captain was killed, and a crew member was reported missing during the incident. No pollution was reported. The body of the missing crew member was later recovered from the submerged wreck.","Anchor Handling Tug Supply","Loss of life,Total loss of the ship","1267","","1360","","","","","[Primary Annex 2 not designated]","[Primary Annex 2 not designated]","[Primary Annex 2 not designated]","[Primary Annex 2 not designated]","[Primary Annex 2 not designated]","[Primary Annex 2 not designated]","",""
"C0013768","1","SALAR (IMO 8801125)","SALAR: Unknown/unspecified","ATG","2021-05-31 13:50","Serious","555123N 0124994E","Port","2","0","Fire or explosion","Kvistgaard Jrn och Metall AB was a scrap metal recycling company that had a facility in Landskrona harbour. On the morning of 31 May 2021, a scrap shipment was being loaded on the vessel SALAR. The cargo was declared as metal waste and was to be exported to Latvia on behalf of the recycling company. Shortly before 2 p.m. smoke developed in the cargo hold. The crane operator assumed that it was a powder fire extinguisher that broke and continued loading. After a short while the smoke development increased, the loading was stopped and the port staff called 112. Resources from the Landskrona Fire Service arrived at the scene shortly after the alarm and The Coast Guard assisted in the extinguishing work. The development of smoke was extensive which resulted in an evacuation of a shipyard in the wind direction. Also, a so-called Important Announcement to the Public signal was sent out. It took almost twelve hours to extinguish the fire. The fire caused minor damage to the vessel. The metal waste was mixed with different types of combustible material such as foam plastic, car tires and wood. Small amounts of flammable liquid were also found in the waste. The probable cause of fire was sparks or frictional heat generated during loading that ignited flammable liquid or other flammable material. The inspections of the waste were insufficient and waste with hazardous properties was therefore not removed. The risks of handling metal waste mixed with combustible material had also not been properly addressed.","General Cargo Ship","","2351","","3432","","7","0","","0","0","0","0","0","0","2023-02-17",""
"C0013624","1","OBSERVADOR (IMO 9179165)","OBSERVADOR: SOLAS","ARG","2021-05-29 09:50","Very serious","343800S 0582089W","Aguas Interiores, Proximidades del Km 1 del Canal de Acceso Sur al Puerto de Boca del Riachuelo","0","0","Machinery damage","El día 29 de mayo de 2021 a las 09:50 horas el B/R “Observador” durante un servicio de asistencia a un buque de salida, a la altura del Km 1 del Canal de Acceso Sur al Puerto de Boca del Riachuelo, tuvo un inconveniente en sala de máquinas por el cual debió regresar de emergencia y amarrar en el Puerto de Boca del Riachuelo.","Tug","Loss of life,Ship rendered unfit to proceed","253","","216","","6","","","[Primary Annex 2 not designated]","[Primary Annex 2 not designated]","[Primary Annex 2 not designated]","[Primary Annex 2 not designated]","[Primary Annex 2 not designated]","[Primary Annex 2 not designated]","",""
"C0013582","1","NAZMIYE ANA (IMO 8516598)","NAZMIYE ANA: Unknown/unspecified","PAN","2021-05-28 00:00","Very serious","395759N 0000140E","Port","3","0","Capsizing / listing","During the afternoon of 28 May 2021, the general cargo vessel NAZMIYE ANA was carrying out cargo operations, berthed starboard side to the quay at the NOATUM terminal in the port of Castelln. At 20:35 local time, after the port crane had loaded the last container on deck, the vessel began to heel to starboard without stopping, causing the stevedoring company personnel and crew on board to move to the quay or jump into the water. The vessel ended up turning around. Two workers from the stevedoring company were injured and had to be taken to hospital for medical treatment. A crew member and a stevedore were unable to jump onto the quay and were trapped underwater, so a search operation involving the underwater activities group of the GUARDIA CIVIL and SASEMAR was deployed for several days. The body of the crew member was recovered the day after the accident ocurred. The body of the stevedore was recovered twelve days after the accident, once the vessel was removed from the water. The vessel was declared a total lost.","General Cargo Ship","Loss of life,Pollution,Serious injuries,Ship rendered unfit to proceed","1416","","1550","","9","0","0","1","0","1","0","0","2","2022-07-06",""
"C0013703","1","BYAKKO (IMO 9883510)","BYAKKO: SOLAS, ULSAN PIONEER: Unknown/unspecified","JPN","2021-05-27 23:53","Very serious","340906N 1325424E","Japan","0","0","Collision","The ship had a collision with MV 'Ulsan Pioneer' whilst underway in Aki-Nada 2 miles NW of Imabari, Japan, in LAT. 34 09' 07"" N, LONG. 132 54' 24"" E AT 23:53 HOURS LT (UTC+9) ON 27 May 2021.
Sustained hull damage took water and sank further NW at 0245 LT. The following morning, 9 crew were rescued; 2 suffered injuries and were given medical attention. SAR operations effected by the Japan coast guard. Divers later recovered the body of a crew member from the steering compartment on 30 May 2021. The remaining 2 crew members are missing. Oil removal was effected before the removal of the wreck.","Ro-Ro Cargo Ship","Loss of life,Total loss of the ship","11454","","6800","","","","","[Primary Annex 2 not designated]","[Primary Annex 2 not designated]","[Primary Annex 2 not designated]","[Primary Annex 2 not designated]","[Primary Annex 2 not designated]","[Primary Annex 2 not designated]","",""
"C0013323","2","AMUR (IMO 8910665), Hokku Maru 8 (-)","AMUR: Non-SOLAS, Hokku Maru 8: Unknown/unspecified","RUS","2021-05-26 08:30","Very serious","442910N 1433490E","open sea","1","0","Collision","In conditions of restricted visibility, the fishing vessel «Amur» collided with the japanese plastic motor boat «Hokku Maru-8». In result of collision the japanese boat capsized and remained afloat. On board of the «Amur» were raised 5 crewmembers of the «Hokku Maru-8», three out of five сrewmembers were dead","Fishing Vessel","Loss of life","662","","546","","","","","[Primary Annex 2 not designated]","[Primary Annex 2 not designated]","[Primary Annex 2 not designated]","[Primary Annex 2 not designated]","[Primary Annex 2 not designated]","[Primary Annex 2 not designated]","2022-06-17",""
"C0013248","1","X-PRESS PEARL (IMO 9875343)","X-PRESS PEARL: SOLAS","SGP","2021-05-20 00:00","Very serious"," ","about 9.5 nautical miles northwest of Colombo harbour","1","0","Fire or explosion","The Singaporean containership X PRESS PEARL  was in anchorage about 9.5 nautical miles northwest of Colombo harbour when caught fire in the afternoon May 20, on Colombo Anchorage, Sri Lanka","Container Ship (Fully Cellular)","Total loss of the ship","31629","","36150","","25","","","[Primary Annex 2 not designated]","[Primary Annex 2 not designated]","[Primary Annex 2 not designated]","[Primary Annex 2 not designated]","[Primary Annex 2 not designated]","[Primary Annex 2 not designated]","2022-07-08",""
"C0013305","1","RAMONA (-)","RAMONA: Unknown/unspecified","DNK","2021-05-19 01:00","Very serious","545750N 0152527E","Open sea","1","0","Stranding / grounding","Crewmember missing on board. Ship found off the coast of Kolobrzeg, Poland without crewmember on board 20-05-2021 in the morning at 09:53 by border guard. Search and rescue initiated in Poland and in Denmark without success.","Fish Catching Vessel","Loss of life,Ship remains fit to proceed","13.6","","","","1","0","","1","0","0","0","0","0","2021-10-08",""
"C0013701","1","PAPAA 305 (IMO 8784327)","PAPAA 305: SOLAS","KNA","2021-05-17 00:00","Very serious","191522N 0722025E","India","0","0","Collision","Dragged anchor, took water in the engine room, in collision with an oil rig and sank in the Arabian sea 33 miles NW of Mumbai, India, in LAT. 19 15' 23"" N, LONG. 072 20' 25"" E on 17 May 2021 in cyclone 'Tauktae'.
Indian navy vessels, including destroyers 'Kochi' and 'Kolkata', Indian coast guard ship 'Samarth', a navy sea king helicopter and nearby offshore vessels, assisted with SAR operations. 186 crew rescued and taken to Mumbai. 67 bodies were recovered and positively identified. Bodies believed to be the 4 remaining crew recovered and awaiting identification. Smit salvage commenced cutting up and removing the wreck using the floating crane 'Taklift 7' from Dec 2021.","Work/Repair Vessel","Loss of life,Total loss of the ship","8882","","8904","","","","","[Primary Annex 2 not designated]","[Primary Annex 2 not designated]","[Primary Annex 2 not designated]","[Primary Annex 2 not designated]","[Primary Annex 2 not designated]","[Primary Annex 2 not designated]","",""
"C0013702","1","VARAPRADA (IMO 8222161)","VARAPRADA: SOLAS","IND","2021-05-17 00:00","Very serious","190046N 0723103E","India","0","0","Sinking","The ship sank in the Arabian sea 19 miles w of Mumbai, India, in LAT. 19 00' 47"" N, LONG. 072 31' 03"" E PM on 17 May 2021 in heavy weather from cyclone 'Tauktae'.
The broken anchor chain took water in the engine room and lost power before sinking. 2 crew members were rescued from a life raft and taken by an Indian navy destroyer ins 'Kochi' to Mumbai. The bodies of 6 crew recovered from the water and were positively identified. Bodies believed to be the 5 remaining crew recovered and awaiting identification. Indian navy divers searched the sunken wreck on 24/05/21 and confirmed no bodies were inside.","Tug","Loss of life,Total loss of the ship","747","","578","","","","","[Primary Annex 2 not designated]","[Primary Annex 2 not designated]","[Primary Annex 2 not designated]","[Primary Annex 2 not designated]","[Primary Annex 2 not designated]","[Primary Annex 2 not designated]","",""
"C0013311","2","BUSTER (-), STAVFJORD (IMO 9321380)","BUSTER: Unknown/unspecified, STAVFJORD: Unknown/unspecified","DNK,NLD","2021-05-16 01:00","Serious","573706N 0103858E","Open sea","0","0","Collision","Collision between cargo ship and fishing vessel, On board both ships both of the watchkeeping crew was bussy doing other things then keeping lookaout. Therefore they didnt see each other on none of the two vessels, No one on the bridge / Wheel house - no one was able to alter courses. The fishingvessel managed to continue towards habour with pumpassistance provided by SAR-helicopter. The cargo vessel didnt suffer any damages, exept for scrathes in the paint.","General Cargo Ship","Ship remains fit to proceed","4206","Bureau Veritas (BV)","107.64","","9","0","","0","0","0","0","0","0","",""
"C0013514","1","Horizon (-)","Horizon: Unknown/unspecified","IRL","2021-05-14 00:00","Very serious","511900N 0081699W","Open sea","3","0","Fire or explosion","Shortly before 02.00 hours (hrs) on the morning of Thursday 14 May 2021 the fishing vessel (FV) Horizon was fishing with four crew onboard, approximately 20 nautical miles (NM) off the Old Head of Kinsale, County Cork, when the Skipper noticed large amounts of smoke coming from the accommodation of the vessel. Despite the crews firefighting efforts, the fire took hold and spread. The Skipper broadcast a MAYDAY distress call by Very High Frequency (VHF) radio and the crew took to a life raft. The crew were recovered from their life raft by the offshore supply ship Pathfinder, but despite efforts to fight the fire by a responding offshore supply ship Maersk Maker, the fishing vessel sank at approximately 07.00 hrs, close to the position where it initially caught fire. There was some sea surface oil pollution reported which appears to have dissipated naturally. Weather and sea conditions at the time were good with light winds and a moderate sea. The crew were subsequently transferred to the Courtmacsherry Lifeboat and brought ashore. There were no injuries suffered by the crew.","Fish Catching Vessel","Ship rendered unfit to proceed","81","","","","","0","","0","0","0","0","0","0","2022-05-03",""
"C0013601","2","CHRISTOS XXIV (IMO 7041625), VARZUGA (IMO 7500401)","CHRISTOS XXIV: Unknown/unspecified, VARZUGA: Unknown/unspecified","PAN,RUS","2021-05-03 00:00","Serious","500880N 0020820W","Open sea","2","0","Damages to ship or equipment","On the 4th of May 2021, following the rupture of the towing line in a convoy between the tug Christos XXIV and the laid-up oil tanker Varzuga, an assistance operation involving numerous parties took place under the national maritime emergency response plan ORSEC level 3 (highest level under the Organisation of the Civil Security Response, ORSEC, at sea), activated by the Maritime Prefecture for the Channel and the North Sea. Following this incident at sea, Abeille Libert escorted a convoy formed of Varzuga, towed by Christos XXIV and a tug chartered as an emergency, Mustang, to Le Havre port.","Oil Tanker","","11290","","16038","","","0","","0","0","0","0","0","0","2022-08-09",""
