Reference,NumberOfShipsInvolved,ShipsInvolved,SOLASStatus,FlagStates,IncidentDateTime,TypeOfCasualty,Coordinates,Location,NumberOfInvestigationReports,NumberOfAnalyses,InitialEvent,SummaryOfEvents,ShipType1,Consequences1,GrossTonnage1,ClassificationSociety1,Deadweight1,Cargo1,CrewOnboard1,PassengersOnboard1,OthersOnboard1,DeadMissingCrew2,DeadMissingPassengers2,DeadMissingOthers3,SeriouslyInjuredCrew2,SeriouslyInjuredPassengers2,SeriouslyInjuredOthers2,InvestationReportDate,AnalysisDate
"C0013754","1","AUSEKLIS (IMO 8315956)","AUSEKLIS: Unknown/unspecified","LVA","2021-12-31 21:00","Very serious","740499N 0030000E","Open sea","2","0","Fire or explosion","On January 1, 2022, the Transport Accident and Incident Investigation Bureau (hereinafter referred to as the Bureau) received a report by phone from representatives of the Maritime Administration of Latvia, that fire broke out on the fishing trawler AUSEKLIS in the Barents Sea. The ship's management and crew acted professionally in accordance with standard shipboard accident/emergency procedures and within 10 minutes the fire was extinguished, but the engine room central electric panel burned, the ship lost propulsion and power.v The master of the ship sent a MAYDAY signal at 01.40 (4 minutes after the fire started), receiving immediate confirmation from the Norwegian Coast Guard. The rescue ship BISON left the port of Batsfjord at 02.53 to provide assistance to the ship AUSEKLIS, reaching it at 22.10. As a result of the rescue operation, the ship was towed to the port of Hammerfest in Norway on January 04, 2022. Crew 23 people, no injuries.","Fish Catching Vessel","Ship rendered unfit to proceed","1410","Bureau Veritas (BV)","883","","23","0","","0","0","0","0","0","0","2023-02-07",""
"C0013638","1","EL LEÓN VI (-)","EL LEÓN VI: Non-SOLAS","ARG","2021-12-30 18:00","Serious","342055S 0583125W","Aguas Interiores, Canal Honda, Tigre, Buenos Aires","0","0","Fire or explosion","El 30 de diciembre de 2021 a las 18:00 horas la lancha de pasajeros tipo colectivo EL LEÓN VI, navegaba con pasajeros a bordo por el Canal Honda con destino al puerto de Tigre cuando se detectó la presencia de humo en proximidades del motor en la zona media de la embarcación. Posteriormente se observó fuego y las personas a bordo abandonaron la embarcación. Como consecuencia del suceso la embarcación sufrió daños materiales, no se reportaron víctimas fatales ni personas lesionadas.","Passenger Ship","Ship rendered unfit to proceed","14","","","","","","","[Primary Annex 2 not designated]","[Primary Annex 2 not designated]","[Primary Annex 2 not designated]","[Primary Annex 2 not designated]","[Primary Annex 2 not designated]","[Primary Annex 2 not designated]","",""
"C0013829","1","ASIATIC SUN (IMO 9402768)","ASIATIC SUN: SOLAS","SGP","2021-12-26 07:33","Serious","241820N 1203609E","Taichung port","1","0","Contact","On the morning of 26 December 2021, at about 0733H, the Singapore registered container vessel, Asiatic Sun (AS) crashed to the no.8A pier, at Taichung Port, Taiwan while berthing under pilotage. The accident did not result in any fatality or injury to personnel and did not result in any pollution. 

The incident vessel suffered structural damage to its bow, the deck area at the bow was distorted downward and cracked at the port side, the reinforced anchor recess was broken, and its shell plate area was distorted. The extent of the damage to the 8A pier was about 10m in length and 4m in width, one rubber fender affixed to the pier’s structure was damaged.
","Container Ship (Fully Cellular)","Ship rendered unfit to proceed","9610","American Bureau of Shipping (ABS)","12774","Container","18","","","[Primary Annex 2 not designated]","[Primary Annex 2 not designated]","[Primary Annex 2 not designated]","[Primary Annex 2 not designated]","[Primary Annex 2 not designated]","[Primary Annex 2 not designated]","2023-06-22",""
"C0013340","1","Avijan-10 (-)","Avijan-10: Unknown/unspecified","BGD","2021-12-24 03:00","Very serious"," ","Bangladesh","0","0","Fire or explosion","MV Avijan-10 while traveling from  from Dhaka, the capital, to Barguna, about 250km (155 miles) to the south, caught fire off the coast of Jhalokati district on the Sugandha River, toward the end of the journey.
The fire resulted in 39 losses and 70 injuries.","Passenger Ship","Loss of life,Serious injuries,Total loss of the ship","","","","","","","","[Primary Annex 2 not designated]","[Primary Annex 2 not designated]","[Primary Annex 2 not designated]","[Primary Annex 2 not designated]","[Primary Annex 2 not designated]","[Primary Annex 2 not designated]","",""
"C0013666","2","TROPIC BREEZE (IMO 8906315), UTOPIA IV (IMO 9851050)","TROPIC BREEZE: Unknown/unspecified, UTOPIA IV: Unknown/unspecified","BLZ,USA","2021-12-23 02:03","Very serious","252704N 0773700W","Berry Islands","1","0","Collision","Collision between Tropic breeze tanker and Utopia 4 super yacht causing the tanker to sink - no loss of life","Products Tanker","","348","","750","","","","","[Primary Annex 2 not designated]","[Primary Annex 2 not designated]","[Primary Annex 2 not designated]","[Primary Annex 2 not designated]","[Primary Annex 2 not designated]","[Primary Annex 2 not designated]","2023-06-13",""
"C0013760","1","HEBEI UNIVERSE (IMO 9420590)","HEBEI UNIVERSE: SOLAS","HKG","2021-12-17 21:30","Very serious","354400N 1210150E","Qing Dao Anchorage","1","0","fatal accident occurred on cage top of elevator","On 17 December 2021, a fatal accident happened on board the Hong Kong registered bulk carrier “Hebei Universe” (the vessel) at Qingdao Chaoliangdao anchorage, China.
At 1735 hours, the duty Oiler (the Oiler) informed the Electrician Officer (the ETO) that the common alarm (the alarm) of the elevator of the vessel (the elevator) activated. The ETO replied that he would check the elevator the next day. At 2130 hours, the duty Engine Trainee (the M/M) discovered some blood came out from the entrance door of the elevator (the entrance door) on the upper deck and immediately reported the situation to the Third Engineer (the 3/E). The 3/E shouted to the entrance door but nobody answered. He then immediately reported the incident to the Chief Engineer (the C/E) and the Master. The engine room crew removed the entrance door on the upper deck and found the ETO was unconscious, lying on the cage top of the elevator bleeding from his nose and mouth. Afterwards, the vessel shifted to the inner anchorage of Qingdao with the permission of the port authority to seek shore medical treatment for the ETO. Unfortunately, the ETO was declared dead after the examination by the shore medical officer in the early morning of 18 December 2021.","Bulk Carrier","Loss of life,Ship remains fit to proceed","94710","China Classification Society (CCS)","182459","","23","","","[Primary Annex 2 not designated]","[Primary Annex 2 not designated]","[Primary Annex 2 not designated]","[Primary Annex 2 not designated]","[Primary Annex 2 not designated]","[Primary Annex 2 not designated]","2023-02-13",""
"C0013733","1","LITE FERRY 10 (IMO 8618695)","LITE FERRY 10: SOLAS","PHL","2021-12-16 00:00","Very serious","095200N 1235000E","Catagbacan, Bohol, Philippines","0","0","Wrecked/stranded","Stranded after dragging anchor, capsized and partially sank whilst moored off Catagbacan, Bohol, Philippines in lat. 09° 52' 32"" N, long. 123° 50' 03"" E on 16/12/21 in heavy weather from typhoon 'Odette'. Philippine coast guard vessels and MVS 'LCT Poseidon 24' and 'Lite Ferry 88' rescued 25 crew. The master went missing and his body was recovered from the nearby mangroves 2 days later. Wreck abandoned in situ.","Passenger/Ro-Ro Ship (Vehicles)","Loss of life,Total loss of the ship","999","","423","","","","","[Primary Annex 2 not designated]","[Primary Annex 2 not designated]","[Primary Annex 2 not designated]","[Primary Annex 2 not designated]","[Primary Annex 2 not designated]","[Primary Annex 2 not designated]","",""
"C0013679","1","BELLONA (IMO 6514376)","BELLONA: SOLAS","ROU","2021-12-14 09:00","Very serious","431200N 0274700E","Varna MTG Shipyard","2","0","Fire or explosion","On December 14, 2021 m/v Bellona was located in the shipyard “MTG – Dolphin” for repair works.
On December 13, 2021 in one of the ballast tanks hot work took place for cutting some bolts (to dismantle a valve). 
It was done by workers of the subcontractor company ” Galera 07”.
On the morning of December 14, 2021, 2 workers from the company re-entered the tank.
No new hot works were planned for the day. Nevertheless a fire broke out a little later.
After the fire was extinguished, one of the workers was found dead.","Products Tanker","Loss of life,Ship remains fit to proceed","2460","","3794","","","","","0","0","1","0","0","0","2023-05-16",""
"C0013694","1","Curacao Trader (IMO 9340908)","Curacao Trader: Unknown/unspecified","MLT","2021-12-13 16:31","Serious","172848N 0630033W","Coastal waters (within 12 miles)","1","0","Fire or explosion","Whilst Curacao Trader was manoeuvring towards the designated anchorage area, off St. Eustatius, a fire broke out in the engine-room, in the vicinity of diesel generator no. 2. The crew members evacuated the engine-room, following which, the fire was extinguished using the vessels fixed firefighting system. While none of the crew members were injured, the vessel sustained significant damages, which took more than three months to repair. The safety investigation concluded that diesel oil sprayed out from a connection on diesel generator no. 2s fuel filter assembly, due to a damaged O-ring, and ignited after coming into contact with hot surfaces.","Chemical Tanker","Ship rendered unfit to proceed","7687","Bureau Veritas (BV)","11255","Other liquid","17","0","0","0","0","0","0","0","0","2023-01-05",""
"C0013676","1","RYON HWA 3 (IMO 8312227)","RYON HWA 3: SOLAS","PRK","2021-12-13 15:30","Very serious","301631N 1221694E","Xiaochangtu Shan, Zhoushan, China","1","0","Stranding / grounding","At about 1530 on 13 September, 2021, a general cargo ship Ryonhwa 3 at anchor, was stranded on the breakwater(30°16.32′N 122°16.947′E) off Xiaochangtu Shan, Zhoushan, China, due to No.14 of Typhoon, resulted in constructive total loss with no loss of life.","General Cargo Ship","Total loss of the ship","5463","","7226","","25","","","[Primary Annex 2 not designated]","[Primary Annex 2 not designated]","[Primary Annex 2 not designated]","[Primary Annex 2 not designated]","[Primary Annex 2 not designated]","[Primary Annex 2 not designated]","2022-12-12",""
"C0013335","2","KARIN HOJ (IMO 8685844), SCOT CARRIER (IMO 9841782)","KARIN HOJ: Unknown/unspecified, SCOT CARRIER: SOLAS","GBR,XDA","2021-12-13 03:30","Very serious","551340N 0141469E","Baltic Sea, off Sweden","1","0","Collision","The Danish-registered cargo ship Karin Hoej collided with the united Kingdom registered flagged vessel Scot Carrier in the Baltic Sea off the Swedish coast, causing one to overturn. The collision occurred on 13 December 2021  The Scot Carrier was en route to the east coast of Scotland. It is not clear what cargo it was transporting or how many people were on board.
The Scot Carrier is 90m (295ft) long and the Karin Hoej is 55m.

As a result of the collision, the cargo ship Karin Hoj capsized with two crew missing.","Hopper, Motor","Loss of life","408","","492","","","","","2","0","0","0","0","0","2023-11-08",""
"C0013637","1","DON TOMASSO (-)","DON TOMASSO: Non-SOLAS","ARG","2021-12-11 10:55","Very serious","433000S 0645500W","Mar Argentino, Rawson Provincia de Chubut","1","0","Capsizing / listing","El 11 de diciembre de 2021 aproximadamente a las 10:551 el B/P Don Tomasso se encontraba en maniobra de pesca a 12 mn de la costa, cuando se dio vuelta campana y se hundió. Como consecuencia del suceso el B/P Sofía B y el B/P Caleta Paula acudieron al auxilio de la tripulación, rescatando esta última embarcación a 6 tripulantes con vida, y el B/P Sofía B el cuerpo sin vida de uno de los marineros.","Fish Catching Vessel","Loss of life,Total loss of the ship","37","[Flag Administration]","","","","","","[Primary Annex 2 not designated]","[Primary Annex 2 not designated]","[Primary Annex 2 not designated]","[Primary Annex 2 not designated]","[Primary Annex 2 not designated]","[Primary Annex 2 not designated]","2022-11-11",""
"C0013807","1","MOANA CHIEF (IMO 9516741)","MOANA CHIEF: SOLAS","NZL","2021-12-10 07:26","Unspecified"," ","Ports of Auckland","1","0","","On the morning of 10 December 2021, the container vessel Moana Chief was preparing to leave the Port of Auckland. The crew had started retrieving the telescopic accommodation ladder when a crew member’s lower leg got trapped between the fixed upper ladder and the moving lower ladder, resulting in serious injury to their leg.
As crew members were retrieving the accommodation ladder, it slipped off the Port platform on which it was resting. The slack side chains allowed the ladder to drop and the weight of the ladder was transferred to the fall wire, which caused the lower ladder to slide upwards. A crew member, who was standing in an area that had previously been identified and designated as a danger area, was seriously injured.
Actions to retrieve the accommodation ladder were not consistent with the procedures documented in the vessel's Safety Management System. Several control measures listed in the risk assessment for deploying and retrieving the accommodation ladder were not implemented. 
It is very likely that the accident could have been prevented, if other crew members standing in the vicinity had intervened and alerted the winch operator to a crew member standing in the designated danger area.
","Container Ship (Fully Cellular)","Serious injuries","18358","DNV GL AS","23305","Containers","16","","","[Primary Annex 2 not designated]","[Primary Annex 2 not designated]","[Primary Annex 2 not designated]","[Primary Annex 2 not designated]","[Primary Annex 2 not designated]","[Primary Annex 2 not designated]","2023-05-08",""
"C0013636","1","SUMATRA (IMO 5343718)","SUMATRA: Non-SOLAS","ARG","2021-12-09 06:45","Serious","404350S 0645600W","Aguas Interiores, Muelle Heleno Arcángel, Puerto de San Antonio Oeste, Rio Negro","2","0","Fire or explosion","El 9 de diciembre de 2021 aproximadamente a las 06:451 el buque Sumatra se encontraba amarrado en el muelle “Heleno Arcángel” del puerto de San Antonio Oeste, Río Negro, cuando se originó un incendio que se extendió también a otro buque pesquero, amarrado en andana. Como consecuencia del suceso se reportaron daños en ambos buques y en el muelle. No se registraron personas lesionadas ni daños al medio ambiente. ","Fish Factory Ship / Fish Carrier","Ship rendered unfit to proceed","173","[Flag Administration]","85","","","","","[Primary Annex 2 not designated]","[Primary Annex 2 not designated]","[Primary Annex 2 not designated]","[Primary Annex 2 not designated]","[Primary Annex 2 not designated]","[Primary Annex 2 not designated]","2023-02-14",""
"C0013732","1","SEA QUEEN (IMO 7915591)","SEA QUEEN: SOLAS","TGO","2021-12-08 00:00","Very serious","312700N 0301700E","Mediterranean Sea","0","0","Foundering","Sustained a mechanical failure, developed list and sank in the Mediterranean Sea 17 miles NE of Abu Qir, Egypt in lat. 31° 27' 50"" N, long. 30° 17' 40"" E on 08/12/21 in heavy weather. AHTS 'Maridive 518' and tugs 'Svitzer Rasheed' and 'Svitzer Delta' proceeded to assist. 11 crew rescued and the bodies of 3 remaining crew recovered from the sea and taken ashore. The wreck of the vessel remained at the scene","General Cargo Ship","Loss of life,Total loss of the ship","2981","","3778","","","","","[Primary Annex 2 not designated]","[Primary Annex 2 not designated]","[Primary Annex 2 not designated]","[Primary Annex 2 not designated]","[Primary Annex 2 not designated]","[Primary Annex 2 not designated]","",""
"C0013560","1","ALMIRANTE STORNI (IMO 9497452)","ALMIRANTE STORNI: SOLAS","LBR","2021-12-04 14:45","Serious","573370N 0113520E","Gothanburg Anchorage","1","0","Fire or explosion","At 1445 LT on 4 December 4, 2021, while the vessel was at anchor in Gothenburg Anchorage ""A"", and the ship was taking bunkers from the barge AMAK SWAN on the port side, the duty watch stander reported smoke coming form the port side forward.  An alarm was sounded and the crew was mustered to fight the fire and crane number 2. The fire teams continued fighting the flames coming from the under the cargo in hold number 1. near the position of the crane number 1. on the Port side. Fire accelerated due to strong winds. Crew managed to keep the fore under control and stopped the spread until external help arrived from Swedish Coast Guard.  ","Bulk Carrier","","19994","DNV GL AS","31796","Sawn Timber","17","","","0","0","0","0","0","0","2024-07-10",""
"C0013502","1","TAMIMI 6 (IMO 9910442)","TAMIMI 6: SOLAS","SAU","2021-12-02 18:20","Less serious","280100N 0441000E","TNAJEEP","2","0","Collision","On December 2, 2021, at the time of 1820 on Thursday, the ship was heading from the Arab field to the port of Tanajib and collided with a sea buoy, where the wind speed at the time of the accident was high and reached between 20-25 knots per hour, which caused the ship to push towards the sea buoy, as well as confusion The assistant who was driving the ship due to stress and fatigue as a result of working between (6) hours of work and (6) hours of rest for a period of (8) continuous months without a vacation","Crew/Supply Vessel","","293","","82","","","","","[Primary Annex 2 not designated]","[Primary Annex 2 not designated]","[Primary Annex 2 not designated]","[Primary Annex 2 not designated]","[Primary Annex 2 not designated]","[Primary Annex 2 not designated]","2022-04-04",""
"C0013731","1","SHREE KRISHNA-VIII (IMO 8652990)","SHREE KRISHNA-VIII: SOLAS","IND","2021-12-02 00:00","Very serious","152400N 0733400E","Arabian Sea","0","0","","Took water and sank in the Arabian Sea 15 miles W of Mormugao, India in lat. 15° 24' 00"" N, long. 73° 34' 00"" E on 02/12/21 in heavy weather. 2 crew rescued from the water by an Indian coast guard Chetak helicopter and another by a patrol vessel. 2 more were rescued by local fishing vessels and 1 body was recovered. The remaining 4 crew were missing. The rescued crew had been in the sea for over 24 hours and were taken to Goa Medical School for medical treatment. Coast guard Dornier 228 aircraft assisted with continuing SAR operations.","General Cargo Ship","Loss of life,Total loss of the ship","1520","","2450","","","","","[Primary Annex 2 not designated]","[Primary Annex 2 not designated]","[Primary Annex 2 not designated]","[Primary Annex 2 not designated]","[Primary Annex 2 not designated]","[Primary Annex 2 not designated]","",""
"C0013730","1","HOUEI CRYSTAL (IMO 9519559)","HOUEI CRYSTAL: SOLAS","PAN","2021-12-01 16:31","Very serious","385600N 1310900E","Sea of Japan","1","0","Capsizing / listing","Took water in cargo hold no. 2, developed list to port and subsequently sank in the Sea of Japan, 97 miles NE of Ulleung-do, South Korea in lat. 38° 56' 10"" N, long. 131° 09 20"" E at 16:31 hours local time (UTC+9) on 01/12/21 in heavy weather. 17 crew abandoned ship to a lifeboat and nearby MV 'Region 87' attended the scene but was unable to rescue the crew due to the adverse weather. All 17 crew were rescued by a South Korean coast guard vessel 12 hours later and taken to Donghae, South Korea. No serious injuries reported. An 18th crew member fell into the sea earlier the same day and went missing. South Korean, North Korean and Japanese coast guard ships and aircraft effected SAR operations.","General Cargo Ship","Loss of life,Total loss of the ship","5762","","8776","","","","","[Primary Annex 2 not designated]","[Primary Annex 2 not designated]","[Primary Annex 2 not designated]","[Primary Annex 2 not designated]","[Primary Annex 2 not designated]","[Primary Annex 2 not designated]","2023-05-08",""
"C0013563","1","MAMMAD AMIN RESULZADEH (IMO 9175157)","GARAKAC: Unknown/unspecified, MAMMAD AMIN RESULZADEH: SOLAS","LBR","2021-12-01 01:40","Serious","452825N 0364009E","Anchorage in Kerch Strait","0","0","Collision","Prior to Dесеnber 1, 2021, the  MV ""MAMMAD AMIN RESULZADEH"" (IMO 9175157i,пЬеr 202] was at anchor in the KERCH STRAIT, when they received notification from  KASKAZ VTS that the MV ""GARAKAC"" (IMO 7812945) was underway to change her anchorage position but was  had slipped its anchorage position  and was being being set by the wind in the direction of the  MV ""MAMMAD AMIN RESULZADEH."" 
At 01:4S LT the MV ""GARAKAC""s stеrп side collided with MV ""MAMMAD AMIN RESULZADEH."".
At 01:45 LT the MV ""GАRАКАС"" s propeller hooked роrt anchor chain of the ""MAMMAD AMIN RESULZADEH."" .
After inspection of forecastle Ьу deck team in the Ьоw was found the side of the MV  MV ""MAMMAD AMIN RESULZADEH"" was found to be set in about 2 meters above the waterline.
At 02:44 LT the crew of the MV ""MAMMAD AMIN RESULZADEH"" was able to release аuг роrt апсhоr chain, but апсhоr chain had Ьееп tied in а knot Ьу MV ""GARAKAC""s  rореilеr.
At 03:10 АМ local time we геаlizеd that it would поt Ье possible to heave uр апсhоr, as the knot iп the апсhоr chain саппоt pass through the апсhоr hаwse pipe. Master оrdеred to rеlеаsе the апсhоr chain's bitter end as the ships were close to each other and it was about 1.5 NM to the shore. 
At 03:20 АМ LT роrt anchor's chain locker was орепеd and the chain and anchor released. ","General Cargo Ship","Ship rendered unfit to proceed","5056","Russian Maritime Register of Shipping (RMRS)","6131","","","","","[Primary Annex 2 not designated]","[Primary Annex 2 not designated]","[Primary Annex 2 not designated]","[Primary Annex 2 not designated]","[Primary Annex 2 not designated]","[Primary Annex 2 not designated]","",""
"C0013810","2","ATLANTIC GRACE (IMO 9337511), AVIATOR (IMO 9363754)","ATLANTIC GRACE: SOLAS, AVIATOR: SOLAS","HKG,MHL","2021-11-26 20:36","Very serious","223590N 0691439E","Gulf of Kutch","0","0","Collision","On the evening of 26 November 2021, the 18,957 DWT bulk carrier AVIATOR and the 49,999 DWT tanker ATLANTIC GRACE collided in the Gulf of Kutch. AVIATOR was in ballast and was proceeding inbound using the Deep Water route to the anchorage off Kandla. ATLANTIC GRACE was also in ballast and was outbound in the Deep Water route en route Fujairah. AVIATOR was declared a constructive total loss.","Bulk Carrier","Total loss of the ship","11743","Nippon Kaiji Kyokai (NKK)","18957","","22","","","[Primary Annex 2 not designated]","[Primary Annex 2 not designated]","[Primary Annex 2 not designated]","[Primary Annex 2 not designated]","[Primary Annex 2 not designated]","[Primary Annex 2 not designated]","",""
"C0013690","1","Chemical Master (IMO 9558957)","Chemical Master: Unknown/unspecified","MLT","2021-11-22 23:30","Very serious","380971N 0094525W","Open sea","1","0","Fire or explosion","At about 1136 on 14 November 2021, Chemical Master departed Haifa, Israel, loaded with a cargo of petrochemicals bound for Amsterdam, The Netherlands, with an ETA at 0200 on 27 November 2021. At around 2330 on 22 November 2021, a fire was detected in the engine-room whilst the vessel was in transit, about 30 nautical miles (nm) off the coast of Portugal. The crew mustered on the poop deck, where it was confirmed that the fourth engineer and the motorman on duty were missing. Quick closing valves (QCVs) were activated, and the engine-room fire dampers were closed. Fire parties were organised, with the first party entering the engine-room at 2345. At 0000, the fire was declared extinguished. The second fire party entered the engine-room at 0003 and located the missing two crew members on the engine-rooms second deck; the motorman was found inside the ECR and the fourth engineer was outside the ECR. Both crew members were carried to the poop deck and given CPR. In the meantime, the Portuguese Coastguard was contacted for medical assistance and both crew members were eventually airlifted. However, the vessel was later informed that both crew members had not survived. Chemical Master was towed to Lisbon, where temporary repairs were carried out to enable the vessel to sail to Poland for permanent repairs. The safety investigation concluded that the cause of the fire may have been related to either accidental spillage, or spray of diesel oil / waste oil onto the incinerator, directly from the deck above whilst the incinerator was either in use or hot after being operated just before the fire.","Liquefied Gas Tanker","Loss of life,Ship rendered unfit to proceed","8259","Nippon Kaiji Kyokai (NKK)","14298","Chemicals","23","0","0","2","0","0","0","0","0","2023-01-04",""
"C0013774","1","ALTHEA (IMO 9396309)","ALTHEA: SOLAS","MHL","2021-11-22 20:12","Very serious","113100S 0111800E","Offshore Angola","1","0","Fire or explosion","Accommodation space fire, originating in an unoccupied crew cabin, which resulted in the death of one crewmember (who was resting in their cabin at the time of the fire).","Chemical/Products Tanker","Loss of life","5046","DNV GL AS","6333","Chemical and Products","19","0","0","[Primary Annex 2 not designated]","[Primary Annex 2 not designated]","[Primary Annex 2 not designated]","[Primary Annex 2 not designated]","[Primary Annex 2 not designated]","[Primary Annex 2 not designated]","2023-03-01",""
